url,name,author,category
http://ecx.images-amazon.com/images/I/41kSLEoswsL.jpg,"Oral and Maxillofacial Surgery: An Objective-Based Textbook, 2e",,Medical Books
http://ecx.images-amazon.com/images/I/510l0qhi01L.jpg,"Barron's GRE, 21st Edition",Sharon Weiner Green M.A.,Test Preparation
http://ecx.images-amazon.com/images/I/51p5aUY%2BOKL.jpg,George Balanchine: The Ballet Maker (Eminent Lives),Robert Gottlieb,Biographies & Memoirs
http://ecx.images-amazon.com/images/I/51pum0eWe4L.jpg,"A Partner in Holiness: Deepening Mindfulness, Practicing Compassion and Enriching Our Lives Through the Wisdom of R. Levi Yitzhak of Berdichev's, Vol. 2  (Institute for Jewish Spirituality)",Rabbi Jonathan P. Slater DMin,Religion & Spirituality
http://ecx.images-amazon.com/images/I/51PuTPPCxaL.jpg,Construction Scheduling: Principles and Practices (2nd Edition),Jay S. Newitt,Arts & Photography
http://ecx.images-amazon.com/images/I/51uNnIlIwrL.jpg,"Literature and Its Writers: A Compact Introduction to Fiction, Poetry, and Drama",Ann Charters,Literature & Fiction
http://ecx.images-amazon.com/images/I/51VIlqRy-VL.jpg,Straight on Till Morning: The Life of Beryl Markham,Mary S. Lovell,Engineering & Transportation
http://ecx.images-amazon.com/images/I/41n7iZq-0jL.jpg,Diagrammatica: The Path to Feynman Diagrams (Cambridge Lecture Notes in Physics),Martinus Veltman,Science & Math
http://ecx.images-amazon.com/images/I/41xLYt-v6nL.jpg,Book of Common Prayer 1979: Large Print edition,,Christian Books & Bibles
http://ecx.images-amazon.com/images/I/51KyLXczCqL.jpg,A Handful of Stars,Cynthia Lord,Children's Books
http://ecx.images-amazon.com/images/I/51Jku59B9CL.jpg,Almost Anorexic: Is My (or My Loved One's) Relationship with Food a Problem? (The Almost Effect),Ph.D. Jennifer J Thomas,Self-Help
http://ecx.images-amazon.com/images/I/41LkijoCvuL.jpg,Pre-ANDA Litigation: Strategies and Tactics for Developing a Drug Product and Patent Portfolio,,Law
http://ecx.images-amazon.com/images/I/51Tjv23guEL.jpg,"Creative, Successful, Dyslexic: 23 High Achievers Share Their Stories",,Politics & Social Sciences
http://ecx.images-amazon.com/images/I/51C16779N8L.jpg,Organ Transplantation (Health and Medical Issues Today),David Petechuk,"Health, Fitness & Dieting"
http://ecx.images-amazon.com/images/I/51JFeqcU96L.jpg,The Age of Acquiescence: The Life and Death of American Resistance to Organized Wealth and Power,Steve Fraser,Business & Money
http://ecx.images-amazon.com/images/I/51kOYa-LHML.jpg,The Multiples Manual: Preparing and Caring for Twins or Triplets,Lynn Lorenz,Parenting & Relationships
http://ecx.images-amazon.com/images/I/51bWdcsbX0L.jpg,Oregon High: A Climbing Guide to Nine Cascade Volcanoes,Jeff Thomas,Sports & Outdoors
http://ecx.images-amazon.com/images/I/5159f7hqJjL.jpg,HTML & XHTML: The Definitive Guide (6th Edition),Chuck Musciano,Computers & Technology
http://ecx.images-amazon.com/images/I/5178fq2DV3L.jpg,Anti Inflammatory Cookbook - 50 Slow Cooker Recipes With Anti - Inflammatory Ingredients: Great For Gout! (Slow Cooker Cookbooks),Kate Marsh,"Cookbooks, Food & Wine"
http://ecx.images-amazon.com/images/I/51zi2q5JfbL.jpg,Leopard Geckos (Complete Herp Care),Gerald Merker,"Crafts, Hobbies & Home"
http://ecx.images-amazon.com/images/I/51AdbQZwDuL.jpg,Botswana & Its National Heritage,Sandy Grant,Travel
http://ecx.images-amazon.com/images/I/51EdPM0rHkL.jpg,Eat the Rich: A Treatise on Economics,P.  J. O'Rourke,Humor & Entertainment
http://ecx.images-amazon.com/images/I/51V7y865BxL.jpg,Paw Patrol Phonics Box Set (PAW Patrol) (Step into Reading),Jennifer Liberts,Reference
http://ecx.images-amazon.com/images/I/61Yudxp-yeL.jpg,The Official Doctor Who2016 Square Calendar,,Calendars
http://ecx.images-amazon.com/images/I/51t0aUEe0tL.jpg,Battlefields of the Civil War Map,National Geographic Society,History
http://ecx.images-amazon.com/images/I/51IybjClfrL.jpg,5 Centimeters per Second,,Comics & Graphic Novels
http://ecx.images-amazon.com/images/I/51AiMilDWpL.jpg,The Story of the New Orleans Hornets (The NBA: a History of Hoops),Tyler Omoth,Teen & Young Adult
http://ecx.images-amazon.com/images/I/51t2uBEMp3L.jpg,Love in Provence: Romantic Adventures in the South of France,Yvone Lenard,Romance
http://ecx.images-amazon.com/images/I/41aVeVvefKL.jpg,Polymeric Multicomponent Materials: An Introduction,L. H. Sperling,Science & Math
http://ecx.images-amazon.com/images/I/51TI3FwVa%2BL.jpg,Fantasy League,Mike Lupica,Children's Books
http://ecx.images-amazon.com/images/I/31VJtBTmfvL.jpg,Be the Ultimate Assistant: A celebrity assistant's secrets to working with any high-powered employer,Bonnie Low-Kramen,Business & Money
http://ecx.images-amazon.com/images/I/51pnw9xXOtL.jpg,Parables: The Greatest Stories Ever Told (Lifeguide Bible Studies),John White,Christian Books & Bibles
http://ecx.images-amazon.com/images/I/51pqgSj8YoL.jpg,Bali Travels Maldives [Japanese Edition],Giniro Natsuo,Travel
http://ecx.images-amazon.com/images/I/518VXqYR27L.jpg,Microsoft Windows Security Essentials,Darril Gibson,Computers & Technology
http://ecx.images-amazon.com/images/I/51TLjyIjU%2BL.jpg,Shadowrun: Third Edition (FPR25000),FanPro,Science Fiction & Fantasy
http://ecx.images-amazon.com/images/I/51uJz4Jd-hL.jpg,The Crime Wave: Collected Nonfiction (The Ace Performer Collection series),Dashiell Hammett,"Mystery, Thriller & Suspense"
http://ecx.images-amazon.com/images/I/61c4EZtdtNL.jpg,The English Country House Garden,Marcus Harpur,"Crafts, Hobbies & Home"
http://ecx.images-amazon.com/images/I/51JXp76wG1L.jpg,Diary of Anne Frank,Frances Goodrich,History
http://ecx.images-amazon.com/images/I/41uPslzVRgL.jpg,ICD-10-CM 2015: The Complete Official Codebook,,Medical Books
http://ecx.images-amazon.com/images/I/410oYwwjssL.jpg,The Words of Gandhi (Newmarket Words Of Series),Mahatma Gandhi,Religion & Spirituality
http://ecx.images-amazon.com/images/I/61gCGr0YMzL.jpg,Shortcut,Donald Crews,Children's Books
http://ecx.images-amazon.com/images/I/41LiDBXEC-L.jpg,Medical Mycology: Cellular and Molecular Techniques,,"Health, Fitness & Dieting"
http://ecx.images-amazon.com/images/I/51ssxbQig9L.jpg,The First Third,Neal Cassady,Travel
http://ecx.images-amazon.com/images/I/41hJGXQAq%2BL.jpg,Reasons Mommy Drinks,Lyranda Martin-Evans,Humor & Entertainment
http://ecx.images-amazon.com/images/I/41eD1Ln0KlL.jpg,"Manual of High Risk Pregnancy and Delivery, 5e (Manual of High Risk Pregnancy & Delivery)",Elizabeth S. Gilbert RNC  MS  FNPc,Medical Books
http://ecx.images-amazon.com/images/I/41XfKAnD%2BgL.jpg,Oscillations and Waves: An Introduction,Richard Fitzpatrick,Science & Math
http://ecx.images-amazon.com/images/I/51hCxlTZ5EL.jpg,DAMAGES,Barry Werth,Law
http://ecx.images-amazon.com/images/I/41oo7KfL5ML.jpg,Sermons on Timothy and Titus (16th-17th Century Facsimile Edition),John Calvin,Christian Books & Bibles
http://ecx.images-amazon.com/images/I/51U6eq7vu4L.jpg,Oils and Vinegars: Discovering and Enjoying Gourmet Oils and Vinegars,Liz Franklin,"Cookbooks, Food & Wine"
http://ecx.images-amazon.com/images/I/51BLmSCM6dL.jpg,"The Handbook of Painted Decoration: The Tools, Materials, and Step-by-Step Techniques of Trompe L'Oeil Painting",Yannick Guegan,Arts & Photography
http://ecx.images-amazon.com/images/I/41ANPWYHPBL.jpg,"Stage Plays from the Classics: One-Act Adaptations from Famous Short Stories, Novels, and Plays",Joellen Bland,Teen & Young Adult
http://ecx.images-amazon.com/images/I/61INLFujcpL.jpg,Runner's World Meals on the Run: 150 energy-packed recipes in 30 minutes or less,Joanna Sayago Golub,"Cookbooks, Food & Wine"
http://ecx.images-amazon.com/images/I/61zJetR%2BnFL.jpg,Mosaics Inside & Out: Patterns and Inspirations for 17 Mosaic Projects,Doreen Mastandrea,"Crafts, Hobbies & Home"
http://ecx.images-amazon.com/images/I/61Yo1Mi1JOL.jpg,"She Appears! Encounters with Kwan Yin, Goddess of Compassion",Sandy Boucher,Religion & Spirituality
http://ecx.images-amazon.com/images/I/41OSYKAWwFL.jpg,A Companion to Museum Studies,,Business & Money
http://ecx.images-amazon.com/images/I/51N4hEjfIyL.jpg,United States History  Early Years (Level 5): Houghton Mifflin Social Studies,HOUGHTON MIFFLIN,Children's Books
http://ecx.images-amazon.com/images/I/51EU06TQR0L.jpg,Indoor Marijuana Horticulture: The Indoor Bible,Jorge Cervantes,Science & Math
http://ecx.images-amazon.com/images/I/51-RntCdC-L.jpg,"This Book Is Full of Spiders: Seriously, Dude, Don't Touch It (John Dies at the End)",David Wong,Literature & Fiction
http://ecx.images-amazon.com/images/I/51HI3R5ucDL.jpg,The Secret to Long Life in Your DNA: The Beljanski Approach to Cellular Health,Hervé Janecek Ph.D.,"Health, Fitness & Dieting"
http://ecx.images-amazon.com/images/I/41LS0LgettL.jpg,Rabbi Israel Salanter and the Mussar Movement: Seeking the Torah of Truth,Immanuel Etkes,Biographies & Memoirs
http://ecx.images-amazon.com/images/I/51WTCse4XRL.jpg,The Healthiest City: Milwaukee and the Politics of Health Reform,Judith W. Leavitt,Travel
http://ecx.images-amazon.com/images/I/51T3GSdb4hL.jpg,My Fair Gentleman (Proper Romance) (A Proper Romance),Nancy Campbell Allen,Romance
http://ecx.images-amazon.com/images/I/51fgYDde-zL.jpg,Stand Up Paddling: Flatwater to Surf and Rivers (Mountaineering Outdoor Experts) (Moes),Rob Casey,Sports & Outdoors
http://ecx.images-amazon.com/images/I/51SCBOPtu0L.jpg,Your Guide to Zion and Bryce Canyon (True North Series),Mike Oard,Christian Books & Bibles
http://ecx.images-amazon.com/images/I/51rpRrPuNwL.jpg,"Unnatural Talent: Creating, Printing and Selling Your Comic in the Digital Age",Jason Brubaker,Comics & Graphic Novels
http://ecx.images-amazon.com/images/I/41TQKcxPcIL.jpg,Brainstorm: The Power and Purpose of the Teenage Brain,Daniel J. Siegel MD,Parenting & Relationships
http://ecx.images-amazon.com/images/I/51b4r8w9r7L.jpg,E-Commerce Concepts,Dr Randall J Dyck,Computers & Technology
http://ecx.images-amazon.com/images/I/61lX5yjQf%2BL.jpg,Well Enough Alone: A Cultural History of My Hypochondria,Jennifer Traig,Humor & Entertainment
http://ecx.images-amazon.com/images/I/61x8Dfxs9CL.jpg,Basic and Clinical Pharmacology 13 E,Bertram Katzung,Medical Books
http://ecx.images-amazon.com/images/I/51F1112Q6ML.jpg,How to Have a Big Wedding on a Small Budget,Diane Warner,"Crafts, Hobbies & Home"
http://ecx.images-amazon.com/images/I/51bazlq7u6L.jpg,Russian Grammar (Quickstudy: Academic),Inc. BarCharts,Reference
http://ecx.images-amazon.com/images/I/51DMugmdAuL.jpg,Responsible Travel Guide Cambodia,Pujita Nanette Mayeda,Travel
http://ecx.images-amazon.com/images/I/51MyuNfkVGL.jpg,Principles of Marketing (16th Edition) (Newest Edition),Philip T Kotler,Business & Money
http://ecx.images-amazon.com/images/I/51O2-prLrML.jpg,Halo: The Poster Collection,,Arts & Photography
http://ecx.images-amazon.com/images/I/51gO81UQHXL.jpg,Mercy Watson: Something Wonky this Way Comes,Kate DiCamillo,Children's Books
http://ecx.images-amazon.com/images/I/51moAp8QXyL.jpg,If You're Lucky,Yvonne Prinz,Teen & Young Adult
http://ecx.images-amazon.com/images/I/51jnErh-u9L.jpg,Great-Tasting Potatoes Cookbook,Editors of Favorite Name Brand Recipes,"Cookbooks, Food & Wine"
http://ecx.images-amazon.com/images/I/512NdDiYqZL.jpg,The Kuwaiti Oil Fires (Environmental Disasters),Kristine Hirschmann,History
http://ecx.images-amazon.com/images/I/51F3KTDSSRL.jpg,Healing Without Medication: A Comprehensive Guide to the Complementary Techniques Anyone Can Use to Achieve Real Healing,Robert S. Rister,"Health, Fitness & Dieting"
http://ecx.images-amazon.com/images/I/51QRtiFZJtL.jpg,Eternity's Sunrise: The Imaginative World of William Blake,Leo Damrosch,Literature & Fiction
http://ecx.images-amazon.com/images/I/51VnUTL5nKL.jpg,Paraguay (Bradt Travel Guide),Margaret Hebblethwaite,Travel
http://ecx.images-amazon.com/images/I/41I2zm6GAyL.jpg,Treating Trauma and Traumatic Grief in Children and Adolescents,Judith A. Cohen,Medical Books
http://ecx.images-amazon.com/images/I/419TDqP99jL.jpg,A Terrible Revenge: The Ethnic Cleansing of the East European Germans,Alfred-Maurice de Zayas,Law
http://ecx.images-amazon.com/images/I/51Y2pTdUbLL.jpg,Plastics: America's Packaging Dilemma (Island Press Critical Issues Series),Ellen Feldman,Science & Math
http://ecx.images-amazon.com/images/I/519W7i65J%2BL.jpg,Microbiologically Safe Foods,Jose Santos Garcia,"Health, Fitness & Dieting"
http://ecx.images-amazon.com/images/I/41d0t0efHaL.jpg,Life Reimagined: Discovering Your New Life Possibilities,Richard J. Leider,Self-Help
http://ecx.images-amazon.com/images/I/51lXAnDj5RL.jpg,It's St. Patrick's Day (Turtleback School & Library Binding Edition) (Scholastic Reader: Level 1 (Pb)),Rebecca Gomez,Children's Books
http://ecx.images-amazon.com/images/I/61HmWM642cL.jpg,Strands of Sorrow (Black Tide Rising),John Ringo,Science Fiction & Fantasy
http://ecx.images-amazon.com/images/I/51U5u9K%2BABL.jpg,Analytic Philosophy,John-Michael Kuczynski,Politics & Social Sciences
http://ecx.images-amazon.com/images/I/714CGZPM6WL.gif,"The Modern Coral Reef Aquarium, Volume 2 (v. 2)",Svein A. Fossa,"Crafts, Hobbies & Home"
http://ecx.images-amazon.com/images/I/51HdaoFLOpL.jpg,Promises Kept: The Life of an Issei Man,Akemi Kikumura-Yano,Biographies & Memoirs
http://ecx.images-amazon.com/images/I/513K01ND32L.jpg,Vocabulary for the College Bound Student,Harold Levine,Teen & Young Adult
http://ecx.images-amazon.com/images/I/41MXQ3Z8AVL.jpg,Hunting the Rockies: Home of the Giants,Kirt I. Darner,Travel
http://ecx.images-amazon.com/images/I/61tWZaKGBUL.jpg,The Slums of Aspen: Immigrants vs. the Environment in America's Eden (Nation of Nations),Lisa  Sun-Hee Park,Business & Money
http://ecx.images-amazon.com/images/I/41-nm-fpWmL.jpg,"Disaster Law and Policy, Second Edition (Aspen Elective)",Daniel A. Farber,Science & Math
http://ecx.images-amazon.com/images/I/51wRE04dZ9L.jpg,"Mobile & Social Game Design: Monetization Methods and Mechanics, Second Edition",Tim Fields,Computers & Technology
http://ecx.images-amazon.com/images/I/51A2z8I-4DL.jpg,"Ready, Freddy! #22: Science Fair Flop",Abby Klein,Children's Books
http://ecx.images-amazon.com/images/I/51i%2Beq1ghKL.jpg,HSPT Flashcard Study System: HSPT Exam Practice Questions & Review for the High School Placement Test (Cards),HSPT Exam Secrets Test Prep Team,Test Preparation
http://ecx.images-amazon.com/images/I/41oTzSlSYuL.jpg,"On the Backroad to Heaven: Old Order Hutterites, Mennonites, Amish, and Brethren (Center Books in Anabaptist Studies)",Donald B. Kraybill,Christian Books & Bibles
http://ecx.images-amazon.com/images/I/51PtnNC45mL.jpg,Spiritual Astrology: A Path to Divine Awakening,Jan Spiller,Religion & Spirituality
http://ecx.images-amazon.com/images/I/511TCMQWH0L.jpg,"Passing on Bypass Using External CounterPulsation : An FDA Cleared Alternative to Treat Heart Disease Without Surgery, Drugs or Angioplasty. SECOND EDITION",George J. Juetersonke,Medical Books
http://ecx.images-amazon.com/images/I/51KP8VqIdzL.jpg,Walking the Walk (w/DVD): Getting Fit with Faith,Leslie Sansone,"Health, Fitness & Dieting"
http://ecx.images-amazon.com/images/I/61htcGwMUYL.jpg,New Jersey Puzzle Book (Which Way USA?),Andrew Gutelle,Travel
http://ecx.images-amazon.com/images/I/51rSqE9IomL.jpg,The Best American Essays of the Century (The Best American Series),,Literature & Fiction
http://ecx.images-amazon.com/images/I/414hFvfvh9L.jpg,God Made All of Me: A Book to Help Children Protect Their Bodies,Justin S. Holcomb,Parenting & Relationships
http://ecx.images-amazon.com/images/I/51S%2B3WLbwyL.jpg,"Classic baseball cards: The golden years, 1886-1956",Frank Slocum,"Crafts, Hobbies & Home"
http://ecx.images-amazon.com/images/I/51g4FFUldvL.jpg,Garfield 2016 Day-to-Day Calendar,Jim Davis,Calendars
http://ecx.images-amazon.com/images/I/512jvo6DxIL.jpg,Beyond Courage: The Untold Story of Jewish Resistance During the Holocaust,Doreen Rappaport,Children's Books
http://ecx.images-amazon.com/images/I/51r8yBsTUVL.jpg,The Scientist as Rebel (New York Review Books),Freeman Dyson,Science & Math
http://ecx.images-amazon.com/images/I/51c2TA1x6NL.jpg,The Life and Love of Dogs,Lewis Blackwell,Arts & Photography
http://ecx.images-amazon.com/images/I/51IPAyIE3yL.jpg,Fish Tales: Stories & Recipes from Sustainable Fisheries Around the World,Tom Kime,Humor & Entertainment
http://ecx.images-amazon.com/images/I/516Mn8i0SlL.jpg,Health: The Basics (11th Edition),Rebecca J. Donatelle,"Health, Fitness & Dieting"
http://ecx.images-amazon.com/images/I/417yWRlaelL.jpg,Unprocessed: How to achieve vibrant health and your ideal weight.,Chef AJ,"Cookbooks, Food & Wine"
http://ecx.images-amazon.com/images/I/51s40bqSiWL.jpg,U.S. Army Special Forces Guide to Unconventional Warfare: Devices and Techniques for Incendiaries,Army,History
http://ecx.images-amazon.com/images/I/41fDuKMDPyL.jpg,"Most Important Year in a Woman's Life, The/The Most Important Year in a Man's Life",Robert Wolgemuth,Christian Books & Bibles
http://ecx.images-amazon.com/images/I/41Ks0uyRNaL.jpg,Texas Birds: A Folding Pocket Guide to Familiar Species (Pocket Naturalist Guide Series),James Kavanagh,Travel
http://ecx.images-amazon.com/images/I/61LklDw%2BcyL.jpg,A-Z of Embroidery Stitches 2 (A-Z of Needlecraft),,"Crafts, Hobbies & Home"
http://ecx.images-amazon.com/images/I/51YsvDPxuuL.jpg,The Maverick of Copper Creek (Copper Creek Cowboys),R.C. Ryan,Romance
http://ecx.images-amazon.com/images/I/51gFmrZ0WsL.jpg,Monster High: The Scary Cute Collection,Lisi Harrison,Teen & Young Adult
http://ecx.images-amazon.com/images/I/51jrQ7p9bHL.jpg,The ADA Practical Guide to Soft Tissue Oral Disease,Michael A. Kahn,Medical Books
http://ecx.images-amazon.com/images/I/41ZD5vbOhFL.jpg,They Wished They Were Honest: The Knapp Commission and New York City Police Corruption,Michael F. Armstrong,Law
http://ecx.images-amazon.com/images/I/51LBdueNQVL.jpg,What Horses Reveal: From First Meeting to Friend for Life,Klaus  Ferdinand Hempfling,Sports & Outdoors
http://ecx.images-amazon.com/images/I/41a6jrneZ5L.jpg,Vital Breath of the Dao: Chinese Shamanic Tiger Qigong,Zhongxian Wu,Religion & Spirituality
http://ecx.images-amazon.com/images/I/51BPjyAxiFL.jpg,iPhone Application Development For Dummies,Neal Goldstein,Computers & Technology
http://ecx.images-amazon.com/images/I/31zoocO9QuL.jpg,Ian Fleming Introduces Jamaica,,Travel
http://ecx.images-amazon.com/images/I/51jdZBx6bPL.jpg,Art for London Transport 2015 Calendar,,Engineering & Transportation
http://ecx.images-amazon.com/images/I/41cuXWA04fL.jpg,Seneca: Epistles 66-92 (Loeb No. 76),Seneca,Literature & Fiction
http://ecx.images-amazon.com/images/I/619IbdUtRLL.jpg,Wild,,Children's Books
http://ecx.images-amazon.com/images/I/41UjGlA4QpL.jpg,"Principles of Optics: Electromagnetic Theory of Propagation, Interference and Diffraction of Light",Max Born,Science & Math
http://ecx.images-amazon.com/images/I/51Mx0Zj7YDL.jpg,No More Fatigue: Why You're So Tired and What You Can Do About It,Jack Challem,"Health, Fitness & Dieting"
http://ecx.images-amazon.com/images/I/51gYRiiTRIL.jpg,"A Social Security Owner's Manual, 3rd Edition: Your Guide to Social Security Retirement, Dependent's, and Survivor's Benefits",Jim Blankenship,Business & Money
http://ecx.images-amazon.com/images/I/51sfa8q-0mL.jpg,The New Testament: A Historical Introduction to the Early Christian Writings,Bart D. Ehrman,Reference
http://ecx.images-amazon.com/images/I/41Mqp%2BCRhJL.jpg,Stephen Irwin,Vince Aletti,Arts & Photography
http://ecx.images-amazon.com/images/I/51P9WLKoZlL.jpg,The Rewind Files,Claire Willett,Science Fiction & Fantasy
http://ecx.images-amazon.com/images/I/519FQVMBXNL.jpg,Mao: The Unknown Story,Jung Chang,Biographies & Memoirs
http://ecx.images-amazon.com/images/I/51hFggrZpWL.jpg,"Swimming: Swimming Made Easy- Beginner and Expert Strategies For Becoming A Better Swimmer (Swimming, Swimmers Guide, Swim Strokes, Swimming Better)",Ace McCloud,Sports & Outdoors
http://ecx.images-amazon.com/images/I/51L5YeZMjlL.jpg,British Diecast Model Toys Catalogue by John Ramsay (Editor) (1-Nov-2001) Hardcover,John Ramsay (Editor),"Crafts, Hobbies & Home"
http://ecx.images-amazon.com/images/I/41ST0F0KHEL.jpg,Sherlock Holmes: The Major Stories with Contemporary Critical Essays (Bedford Series in History & Culture),Arthur Conan Doyle,"Mystery, Thriller & Suspense"
http://ecx.images-amazon.com/images/I/51jdaDPsQGL.jpg,A is for Abinadi: An Alphabet Book of Scripture Heroes,Heidi Poelman,Christian Books & Bibles
http://ecx.images-amazon.com/images/I/51ioF6W-0iL.jpg,Zoonosi e sanità pubblica: Un approccio interdisciplinare per un problema emergente (Italian Edition),,Medical Books
http://ecx.images-amazon.com/images/I/51FHMBWB47L.jpg,Potatoes (The Australian Women's Weekly Essentials),,"Cookbooks, Food & Wine"
http://ecx.images-amazon.com/images/I/414F2pr0WYL.jpg,Bride in the Solomons,Osa Johnson,Travel
http://ecx.images-amazon.com/images/I/31D1OY8znXL.jpg,Consumerism (Opposing Viewpoints),Roman Espejo,Teen & Young Adult
http://ecx.images-amazon.com/images/I/514zdYKrw3L.jpg,Social Media Marketing All-in-One For Dummies,Jan Zimmerman,Computers & Technology
http://ecx.images-amazon.com/images/I/41yJr7ylM7L.jpg,Fallacies of the Anti Hadith argument,Mr Zubair Ali,Religion & Spirituality
http://ecx.images-amazon.com/images/I/51Ph%2BhRkRJL.jpg,Invitation to Dynamical Systems (Dover Books on Mathematics),Prof. Edward R. Scheinerman,Science & Math
http://ecx.images-amazon.com/images/I/51xZGUIv2mL.jpg,The 7-Day Flat-Belly Tea Cleanse: The Revolutionary New Plan to Melt Up to 10 Pounds of Fat in Just One Week!,Kelly Choi,"Health, Fitness & Dieting"
http://ecx.images-amazon.com/images/I/51twr-9ltZL.jpg,Moomin Book Five: The Complete Tove Jansson Comic Strip,Tove Jansson,Comics & Graphic Novels
http://ecx.images-amazon.com/images/I/613ZgVHpDZL.jpg,The Kentucky Wildcats Fans' Bucket List,Ryan Clark,Travel
http://ecx.images-amazon.com/images/I/51ZlinVOoVL.jpg,Coaching the Complete Triple Gun Offense,Tony Demeo,Sports & Outdoors
http://ecx.images-amazon.com/images/I/515JJGFGRJL.jpg,"Supply Chain Management: Strategy, Planning and Operations",Sunil Chopra,Business & Money
http://ecx.images-amazon.com/images/I/515fhWsXMTL.jpg,America : A Patriotic Primer,Lynne Cheney,Children's Books
http://ecx.images-amazon.com/images/I/61yehdo5pSL.jpg,Black Earth: The Holocaust as History and Warning,Timothy Snyder,History
http://ecx.images-amazon.com/images/I/61QqmtDBSVL.jpg,Agricola Cookbook,Josh Thomsen,"Cookbooks, Food & Wine"
http://ecx.images-amazon.com/images/I/41QG1XFvU%2BL.jpg,"A Philosophical Retrospective: Facts, Values, and Jewish Identity (Columbia Themes in Philosophy)",Alan Montefiore,Politics & Social Sciences
http://ecx.images-amazon.com/images/I/51JcyBoDSiL.jpg,Kokology: The Game of Self-Discovery,Tadahiko Nagao,Humor & Entertainment
http://ecx.images-amazon.com/images/I/61gy9RISjNL.jpg,Growing Hawaii's Native Plants: A Simple Step-by-Step Approach for Every Species,Kerin L. Lilleeng-Rosenberger,"Crafts, Hobbies & Home"
http://ecx.images-amazon.com/images/I/518jDgHO7DL.jpg,Law Enforcement In The United States,James A. Conser,Law
http://ecx.images-amazon.com/images/I/51wLn0J3-bL.jpg,Kuan Yin Oracle Set,Alana Fairchild,Self-Help
http://ecx.images-amazon.com/images/I/31m5vpdap1L.jpg,Biological Models in Radiopharmaceutical Development (Developments in Nuclear Medicine),R.M. Lambrecht,Medical Books
http://ecx.images-amazon.com/images/I/41qBS5hxjiL.jpg,Indiana: Off the beaten path (Off the Beaten Path Indiana),Bill Thomas,Travel
http://ecx.images-amazon.com/images/I/41dESb94nVL.jpg,For the Love of 2am: Poetry For Insomniacs,Zena A. White,Literature & Fiction
http://ecx.images-amazon.com/images/I/61Nco%2BF3jsL.jpg,In a World of Gods and Goddesses: The Mystic Art of Indra Sharma,James H. Bae,Arts & Photography
http://ecx.images-amazon.com/images/I/51ddN9xBrhL.jpg,Introduction to Psychology,James W. Kalat,"Health, Fitness & Dieting"
http://ecx.images-amazon.com/images/I/51aUxUejLKL.jpg,CLEP Micro & Macro Economics Examinations Essential Study References 2013,ExamREVIEW,Test Preparation
http://ecx.images-amazon.com/images/I/418RA0MCCCL.jpg,An Acre of Glass: A History and Forecast of the Telescope,J. B. Zirker,Science & Math
http://ecx.images-amazon.com/images/I/51-qMt1dInL.jpg,The Miracle of Castel Di Sangro,Joe McGinniss,Biographies & Memoirs
http://ecx.images-amazon.com/images/I/518GSGH06HL.jpg,Tales of King Arthur (Library of Fantasy & Adventure),Felicity Brooks,Children's Books
http://ecx.images-amazon.com/images/I/51LXcIqLB1L.jpg,"Visit the Zoo, vol. VI",Tom Smith,Teen & Young Adult
http://ecx.images-amazon.com/images/I/51e8RG1XGcL.jpg,Asset Building & Community Development,Gary P. (Paul) Green,Business & Money
http://ecx.images-amazon.com/images/I/51ISJZX4GXL.jpg,Highland Harmony: Avelina and Drew (Clan Grant Series) (Volume 8),Keira Montclair,Romance
http://ecx.images-amazon.com/images/I/41uhmxTam-L.jpg,Gems from the Equinox: Instructions by Aleister Crowley for His Own Magical Order,Aleister Crowley,Religion & Spirituality
http://ecx.images-amazon.com/images/I/51PPPPG1W9L.jpg,"Rick Steves' Europe DVD: Germany, the Swiss Alps, and Travel Skills (Rick Steves' Europe)",,Travel
http://ecx.images-amazon.com/images/I/61i-CtSmjZL.jpg,Mast Brothers Chocolate: A Family Cookbook,Rick Mast,"Cookbooks, Food & Wine"
http://ecx.images-amazon.com/images/I/51y9qRT4exL.jpg,Trigger Points (Quickstudy: Academic),Inc. BarCharts,Medical Books
http://ecx.images-amazon.com/images/I/51GynpJFAQL.jpg,Active Birth: The New Approach to Giving Birth Naturally (Non),Janet Balaskas,Parenting & Relationships
http://ecx.images-amazon.com/images/I/41EwHr9af5L.jpg,What's The Deal With Bitcoins?,Ryan Lancelot,Computers & Technology
http://ecx.images-amazon.com/images/I/51pGeuuTZeL.jpg,The Elfrida Goto Trilogy (The Solarian War Saga Books 1-3): Three Full-Length Thrilling Space Opera Novels,Felix R. Savage,Science Fiction & Fantasy
http://ecx.images-amazon.com/images/I/51N9h8%2BvIlL.jpg,Leyte 1944: Return to the Philippines (Campaign),Clayton Chun,History
