url,name,author,category
http://ecx.images-amazon.com/images/I/41es9b-vjPL.jpg,Design and Violence,Anne-Marie Slaughter,Arts & Photography
http://ecx.images-amazon.com/images/I/41YXlp2m6AL.jpg,Thirteen Days: A Memoir of the Cuban Missile Crisis,Robert F. Kennedy,History
http://ecx.images-amazon.com/images/I/51rUe3vfrJL.jpg,Resurrection After Rape: A guide to transforming from victim to survivor,Matt Atkinson,Self-Help
http://ecx.images-amazon.com/images/I/416q3vW7IbL.jpg,Drake: Actor & Hip-Hop Artist (Contemporary Lives),Steve Otfinoski,Teen & Young Adult
http://ecx.images-amazon.com/images/I/51VmJ840bEL.jpg,CCFP Certified Cyber Forensics Professional All-in-One Exam Guide,Chuck Easttom,Computers & Technology
http://ecx.images-amazon.com/images/I/51ZW1XVdzIL.jpg,Zeroes: A Novel,Chuck Wendig,"Mystery, Thriller & Suspense"
http://ecx.images-amazon.com/images/I/51KPEzObwlL.jpg,Insight Meditation: The Practice of Freedom,Joseph Goldstein,Religion & Spirituality
http://ecx.images-amazon.com/images/I/51NEHGhVPWL.jpg,The Bear Dogs of Katahdin: And Other Recollections of a Baxter State Park Ranger,Steve Tetreault,Humor & Entertainment
http://ecx.images-amazon.com/images/I/517E5ZKfLnL.jpg,Unbroken Will: The Extraordinary Courage of an Ordinary Man,Bernhard Rammerstorfer,Biographies & Memoirs
http://ecx.images-amazon.com/images/I/51Ml8rSWF%2BL.jpg,Law in a Flash: Evidence 2011,Steven L. Emanuel,Law
http://ecx.images-amazon.com/images/I/51T9e0Fu9qL.jpg,The Divine Comedy: Volume 1: Inferno (Penguin Classics),Dante Alighieri,Literature & Fiction
http://ecx.images-amazon.com/images/I/31J5eUB9cAL.jpg,Oil 101,Morgan Downey,Engineering & Transportation
http://ecx.images-amazon.com/images/I/51XSMUCrCWL.jpg,Shetland Sheepdog Calendar - Breed Specific Shetland Sheepdog Calendar - 2016 Wall calendars - Dog Calendars - Monthly Wall Calendar by Avonside,MegaCalendars,Calendars
http://ecx.images-amazon.com/images/I/51OrRPap0LL.jpg,The Complete Peanuts 1987-1990 Gift Box Set (The Complete Peanuts),Charles M. Schulz,Comics & Graphic Novels
http://ecx.images-amazon.com/images/I/61MvH5nMZ6L.jpg,"Sultans of Deccan India, 1500EE1700: Opulence and Fantasy",Navina Najat Haidar,Arts & Photography
http://ecx.images-amazon.com/images/I/51G50XojEzL.jpg,The Authentic Death and Contentious Afterlife of Pat Garrett and Billy the Kid: The Untold Story of Peckinpah's Last Western Film,Paul Seydor,Humor & Entertainment
http://ecx.images-amazon.com/images/I/51d8PNJFqbL.jpg,Reaper's Property (Ellora's Cave Moderne),Joanna Wylde,Romance
http://ecx.images-amazon.com/images/I/31g6teV9rjL.jpg,Ovid: Heroides: Select Epistles (Cambridge Greek and Latin Classics),Ovid,Literature & Fiction
http://ecx.images-amazon.com/images/I/51UE8nk6IOL.jpg,Sovereign Subjects: Indigenous Sovereignty Matters (Cultural Studies Series),,Law
http://ecx.images-amazon.com/images/I/51lLCCmkXTL.jpg,Nonfiction Sight Word Readers Parent Pack Level D: Teaches 25 key Sight Words to Help Your Child Soar as a Reader!,Liza Charlesworth,Parenting & Relationships
http://ecx.images-amazon.com/images/I/51q363sWwEL.jpg,A Family Apart (Orphan Train Adventures),Joan Lowery Nixon,Teen & Young Adult
http://ecx.images-amazon.com/images/I/51PkwVRMZqL.jpg,Pool Billiard Workout: For Beginners to Intermediate Players (PAT-System Workout),Ralph Eckert,Sports & Outdoors
http://ecx.images-amazon.com/images/I/51o-lUUQp0L.jpg,Grammar in Use Intermediate Student's Book with Answers and CD-ROM: Self-study Reference and Practice for Students of North American English,Raymond Murphy,Politics & Social Sciences
http://ecx.images-amazon.com/images/I/51r2nikr9pL.jpg,AppleWorks 6: the Missing Manual,Jim Elferdink,Computers & Technology
http://ecx.images-amazon.com/images/I/51X2NH1MnTL.jpg,Homeland Revealed,Matt Hurwitz,Humor & Entertainment
http://ecx.images-amazon.com/images/I/51Si1Llx27L.jpg,The Secret Sister,Brenda Novak,Literature & Fiction
http://ecx.images-amazon.com/images/I/418HSBJHAGL.jpg,The Order of the Rod:  A Classic of Victorian Erotica (The erotica series),Margaret Anson,Romance
http://ecx.images-amazon.com/images/I/51dMI44kpbL.jpg,Saudi Arabia by the First Photographers,William Facey,History
http://ecx.images-amazon.com/images/I/51iM%2BvjuGVL.jpg,Escape from Communist Heaven,Dennis W. Dunivan,Teen & Young Adult
http://ecx.images-amazon.com/images/I/41yNggyft-L.jpg,Essentials of Modern Business Statistics with Microsoft Excel,David R. Anderson,Computers & Technology
http://ecx.images-amazon.com/images/I/41bqM12xZ%2BL.jpg,"Cases and Materials on Contracts, 8th (University Casebook Series)",E. Farnsworth,Law
http://ecx.images-amazon.com/images/I/41afeGfKR9L.jpg,Starfish (Rifters Trilogy),Peter Watts,Science Fiction & Fantasy
http://ecx.images-amazon.com/images/I/51Kge5kmaQL.jpg,Sweet Dreams: Wishes for Our Children,Tracy Raver,Arts & Photography
http://ecx.images-amazon.com/images/I/41WG%2B0OgDwL.jpg,How to Win Friends and Influence People in the Digital Age,Dale Carnegie & Associates,Self-Help
http://ecx.images-amazon.com/images/I/41Rya-HR9HL.jpg,The Twenty-Seventh: A Regimental History (Classic Reprint),Winthrop Dudley Sheldon,History
http://ecx.images-amazon.com/images/I/41JnnAMaQUL.jpg,Family Violence (Lucent Overview),Liza N. Burby,Teen & Young Adult
http://ecx.images-amazon.com/images/I/51og4gOWJKL.jpg,Gang Leader for a Day: A Rogue Sociologist Takes to the Streets,Sudhir Venkatesh,Humor & Entertainment
http://ecx.images-amazon.com/images/I/51XE2-GsJaL.jpg,Rand McNally World Folded Wall Map (M Series Map of the World),Rand McNally,Reference
http://ecx.images-amazon.com/images/I/51WlRNrc7ML.jpg,Les Miserables (Leather-Bound Classics),Victor Hugo,Literature & Fiction
http://ecx.images-amazon.com/images/I/51ZHmnQY5wL.jpg,NTSE - National Talent Serach Examination,JAYA GHOSH,Test Preparation
http://ecx.images-amazon.com/images/I/416H-ItT%2B7L.jpg,The Life of Muhammad,I. Ishaq,Biographies & Memoirs
http://ecx.images-amazon.com/images/I/41NBYTu78qL.jpg,Marriage Litigation in Medieval England (Cambridge Studies in English Legal History),R. H. Helmholz,Law
http://ecx.images-amazon.com/images/I/51JRQO8FVkL.jpg,"Creando el Mejor Jugador de Beisbol: Aprende los secretos y trucos utilizados por los mejores jugadores de beisbol profesionales y entrenadores, para ... y fortaleza Mental (Spanish Edition)",Joseph Correa (Entrenador y Atleta Profesional),Sports & Outdoors
http://ecx.images-amazon.com/images/I/61aL-bS1cPL.jpg,Amazing Fantastic Incredible: A Marvelous Memoir,Stan Lee,Comics & Graphic Novels
http://ecx.images-amazon.com/images/I/51MCItFStDL.jpg,Thomas Pheasant: Simply Serene,Thomas Pheasant,Arts & Photography
http://ecx.images-amazon.com/images/I/613v6vUX8tL.jpg,In Search of Dracula: The History of Dracula and Vampires,Radu Florescu,History
http://ecx.images-amazon.com/images/I/51YWrN3rnOL.jpg,Math Art Fun: Teaching Kids to See the Magic and Multitude of Mathematics in Modern Art,Robin Ward,Humor & Entertainment
http://ecx.images-amazon.com/images/I/51QWjGWUV-L.jpg,Chuck's Living Object Tinglers: Volume 2,Dr. Chuck Tingle,Romance
http://ecx.images-amazon.com/images/I/51wKoQ5YCEL.jpg,Suicide (Straight Talk About...(Crabtree)),Rachel Eagen,Teen & Young Adult
http://ecx.images-amazon.com/images/I/51CVY5yc1fL.jpg,"The Geography of Urban Transportation, Third Edition",,Engineering & Transportation
http://ecx.images-amazon.com/images/I/611EEZABKkL.jpg,Radical Cities: Across Latin America in Search of a New Architecture,Justin McGuirk,Politics & Social Sciences
http://ecx.images-amazon.com/images/I/51cdLwM8aSL.jpg,"Middle-earth seen by the barbarians, Vol. 1: The indigenous peoples of Eriador and Gondor (Volume 1)",Codex Regius,Law
http://ecx.images-amazon.com/images/I/51OW6FKKxqL.jpg,Dead Wrong (The Rho Agenda Inception),Richard Phillips,Science Fiction & Fantasy
http://ecx.images-amazon.com/images/I/51O6InqF8QL.jpg,The Old Farmer's Almanac 2016 Weather Watcher's Calendar,Old FarmerEEs Almanac,Calendars
http://ecx.images-amazon.com/images/I/51lfWfiRAeL.jpg,Cometh the Hour (The Clifton Chronicles),Jeffrey Archer,Literature & Fiction
http://ecx.images-amazon.com/images/I/51vE7df-Q4L.jpg,Ladies of the Canyons: A League of Extraordinary Women and Their Adventures in the American Southwest,Lesley Poling-Kempes,Biographies & Memoirs
http://ecx.images-amazon.com/images/I/51qVo7%2BUPbL.jpg,The Girl with the Dragon Tattoo (Millennium Series),Stieg Larsson,"Mystery, Thriller & Suspense"
http://ecx.images-amazon.com/images/I/51k7VlhLxvL.jpg,The Emergence of Minorities in the Middle East: The Politics of Community in French Mandate Syria,Benjamin Thomas White,History
http://ecx.images-amazon.com/images/I/51A36Q4G95L.jpg,"Changing Bodies, Changing Lives: Expanded Third Edition: A Book for Teens on Sex and Relationships",Ruth Bell,Parenting & Relationships
http://ecx.images-amazon.com/images/I/417eQ5d7FiL.jpg,The Design of Everyday Things: Revised and Expanded Edition,Don Norman,Arts & Photography
http://ecx.images-amazon.com/images/I/51eAwdjKFGL.jpg,Volleyball Today (Wadsworth Health Fitness),Marv Dunphy,Sports & Outdoors
http://ecx.images-amazon.com/images/I/41ioBtz8p9L.jpg,Valuing Life: Humanizing the Regulatory State,Cass R. Sunstein,Law
http://ecx.images-amazon.com/images/I/51xJE77ypbL.jpg,Freaks I've Met,Donald Jans,Literature & Fiction
http://ecx.images-amazon.com/images/I/51NpQVAty3L.jpg,Out of Darkness: The Jeff Healey Story,Cindy Watson,Teen & Young Adult
http://ecx.images-amazon.com/images/I/513465Wgo-L.jpg,2015 Pro Football Focus Fantasy Draft Guide,Mike Clay,Humor & Entertainment
http://ecx.images-amazon.com/images/I/51m74hame4L.jpg,Fear and Loathing on the Campaign Trail '72,Hunter S. Thompson,Biographies & Memoirs
http://ecx.images-amazon.com/images/I/61hHp0i6B4L.jpg,Fun & Funky Coloring Book Treasury: Designs to Energize and Inspire (Coloring Collection),Thaneeya McArdle,Arts & Photography
http://ecx.images-amazon.com/images/I/41YJ59Wu0gL.jpg,The Quest for Environmental Justice: Human Rights and the Politics of Pollution,,Law
http://ecx.images-amazon.com/images/I/51n7S9Ima0L.jpg,The Complete Tales of Uncle Remus,Joel Chandler Harris,Politics & Social Sciences
http://ecx.images-amazon.com/images/I/514WCDW02PL.jpg,"The Shetland Bus: A WWII Epic of Escape, Survival, and Adventure",David Howarth,History
http://ecx.images-amazon.com/images/I/51DJc9cnjkL.jpg,The Sweet Spot: How to Find Your Groove at Home and Work,Christine Carter Ph.D.,Self-Help
http://ecx.images-amazon.com/images/I/5180DT8QFkL.jpg,"Not That Kind of Girl: A Young Woman Tells You What She's ""Learned""",Lena Dunham,Humor & Entertainment
http://ecx.images-amazon.com/images/I/51ll73RMF1L.jpg,Ghetto Klown,John Leguizamo,Comics & Graphic Novels
http://ecx.images-amazon.com/images/I/512estreKAL.jpg,Dreadnought (Starship Blackbeard) (Volume 3),Michael Wallace,Science Fiction & Fantasy
http://ecx.images-amazon.com/images/I/41h9%2B-un-7L.jpg,Fifth Grade Vocabulary Flashcards (Flashcards Language Arts),Sylvan Learning,Reference
http://ecx.images-amazon.com/images/I/51VqPqtwTCL.jpg,Vampire Files: Heartthrobs and Bloodsuckers,Amy Rickman,Teen & Young Adult
http://ecx.images-amazon.com/images/I/51xFoMfB9GL.jpg,What's the Big Idea? Ethan Flask and Professor von Offel's Ingenious Inventions (Mad Science),Kathy Burkett,Sports & Outdoors
http://ecx.images-amazon.com/images/I/517yMsoDQoL.jpg,"CLEP: Introductory Psychology, TestWare Edition (Book & CD-ROM)",Don J. Sharpsteen Ph.D.,Test Preparation
http://ecx.images-amazon.com/images/I/5104vqDWpLL.jpg,Vanity Fair (Penguin Classics),William Makepeace Thackeray,Literature & Fiction
http://ecx.images-amazon.com/images/I/51TxQzL0boL.jpg,"SR-71: The Complete Illustrated History of the Blackbird, The World's Highest, Fastest Plane",Richard H. Graham,Engineering & Transportation
http://ecx.images-amazon.com/images/I/51gj1wS6D-L.jpg,"The Mark of the Vampire Queen (Vampire Queen, Book 2)",Joey W. Hill,Romance
http://ecx.images-amazon.com/images/I/41oJwdxAS7L.jpg,"The Conservatarian Manifesto: Libertarians, Conservatives, and the Fight for the Right's Future",Charles C.W. Cooke,Politics & Social Sciences
http://ecx.images-amazon.com/images/I/618X%2BeUYOmL.jpg,The Legend of Zelda 2016 Wall Calendar,Nintendo,Calendars
http://ecx.images-amazon.com/images/I/51U0aP5cNwL.jpg,"Painting Your Favorite Animals in Pen, Ink and Watercolor",Claudia Nice,Arts & Photography
http://ecx.images-amazon.com/images/I/51uJv%2BP1RsL.jpg,Think Like a Champion: An Informal Education in Business and Life,Donald Trump,Literature & Fiction
http://ecx.images-amazon.com/images/I/41ENXSS3f2L.jpg,"Revelations (Blue Blood, Book 3) (Blue Bloods Novel)",Melissa de la Cruz,Teen & Young Adult
http://ecx.images-amazon.com/images/I/41dZvcqmjWL.jpg,Germany: Memories of a Nation,Neil MacGregor,History
http://ecx.images-amazon.com/images/I/41AukvusrAL.jpg,"Psychological Injuries: Forensic Assessment, Treatment, and Law (American Psychology-Law Society Series)",William J. Koch,Law
http://ecx.images-amazon.com/images/I/61HCazRbRiL.jpg,The Mechanics of Sprinting and Hurdling: 2013 Edition,Ralph V. Mann Ph.D.,Sports & Outdoors
http://ecx.images-amazon.com/images/I/51hXxdMb5-L.jpg,Hollywood Presents Jules Verne: The Father of Science Fiction on Screen (Screen Classics),Brian Taves,Humor & Entertainment
http://ecx.images-amazon.com/images/I/41VrJ7PVUZL.jpg,"""A Problem From Hell"": America and the Age of Genocide",Samantha Power,Politics & Social Sciences
http://ecx.images-amazon.com/images/I/51yz5QimcwL.jpg,"The Upside of Fear: How One Man Broke the Cycle of Prison, Poverty, and Addiction",Weldon Long,Biographies & Memoirs
http://ecx.images-amazon.com/images/I/51F9MDJFUNL.jpg,The Stitching Hour: An Embroidery Mystery,Amanda Lee,"Mystery, Thriller & Suspense"
http://ecx.images-amazon.com/images/I/41rzgHpDeWL.jpg,Dreamland,Sarah Dessen,Teen & Young Adult
http://ecx.images-amazon.com/images/I/51B%2BoIbouRL.jpg,David Busch's Canon EOS Rebel T5/1200D Guide to Digital SLR Photography (David Busch's Digital Photography Guides),David D. Busch,Arts & Photography
http://ecx.images-amazon.com/images/I/41%2BDQE5tp-L.jpg,L'Anti Justine: The Delights of Love,Nicolas-Edme Retif,Romance
http://ecx.images-amazon.com/images/I/51LE3uSLWZL.jpg,Antigone: In Plain and Simple English,Sophocles,Literature & Fiction
http://ecx.images-amazon.com/images/I/51gYZcUDW4L.jpg,"PMP Exam Prep Questions, Answers, & Explanations: 1000+ PMP Practice Questions with Detailed Solutions, 5th Edition",Christopher Scordo,Test Preparation
http://ecx.images-amazon.com/images/I/51MBA6SFECL.jpg,New Commentary on the Code of Canon Law: Study Edition,John P. Beal,Law
http://ecx.images-amazon.com/images/I/51d81gOhXvL.jpg,The Sacred Art of Lovingkindness: Preparing to Practice (The Art of Spiritual Living),Rami M. Shapiro,Self-Help
http://ecx.images-amazon.com/images/I/51NlHOXqxPL.jpg,How I Play Golf,Tiger Woods,Biographies & Memoirs
http://ecx.images-amazon.com/images/I/41ZuEO-Q8xL.jpg,Teaching and Using Document-Based Questions for Middle School (Gifted Treasury Series),Edward P. O'Connor,History
http://ecx.images-amazon.com/images/I/51nwXtxRvQL.jpg,The Slangman Guide to Street Speak 1: The Complete Course in American Slang & Idioms,David Burke,Reference
http://ecx.images-amazon.com/images/I/41VmssDXc9L.jpg,"Fermentation and Biochemical Engineering Handbook, 2nd Ed., Second Edition: Principles, Process Design and Equipment",Henry C. Vogel,Engineering & Transportation
http://ecx.images-amazon.com/images/I/41V5hcjyggL.jpg,Sibling Relationships in Childhood and Adolescence: Predictors and Outcomes,Avidan Milevsky,Parenting & Relationships
http://ecx.images-amazon.com/images/I/41EWhmgcltL.jpg,Ultra Marathon Training,Wolfgang Olbrich,Sports & Outdoors
http://ecx.images-amazon.com/images/I/51UzHyHdY3L.jpg,Sundered Skies (Savage Worlds; S2P10009),Dave Blewer,Science Fiction & Fantasy
http://ecx.images-amazon.com/images/I/51lU6BC%2BKgL.jpg,On the Edge of Sunrise: Book One of the Long Hair Saga,Cynthia Ripley Miller,Romance
http://ecx.images-amazon.com/images/I/51YFOZNyDoL.jpg,The Pushcart Prize XXXIX: Best of the Small Presses 2015 Edition (The Pushcart Prize),Bill Henderson,Literature & Fiction
http://ecx.images-amazon.com/images/I/51AlEUytcdL.jpg,The Terrible and Wonderful Reasons Why I Run Long Distances,The Oatmeal,Comics & Graphic Novels
http://ecx.images-amazon.com/images/I/31e8orSDJBL.jpg,The Curator's Handbook,Adrian George,Arts & Photography
http://ecx.images-amazon.com/images/I/515aj-UUI3L.jpg,Smerdon's Scandinavian,David Smerdon,Humor & Entertainment
http://ecx.images-amazon.com/images/I/41RbPfHoHiL.jpg,Flowers: A Universe Revealed 2015 Wall Calendar,Christopher Gruver,Calendars
http://ecx.images-amazon.com/images/I/41KPkLhLpeL.jpg,Legal Duties for Directors: An Association Board Member's Guide to Avoiding Risk While Advancing the Mission,Jerald A. Jacobs,Law
http://ecx.images-amazon.com/images/I/514JwCzFWDL.jpg,FTCE Mathematics 6-12 w/CD-ROM (FTCE Teacher Certification Test Prep),Mel Friedman M.S.,Test Preparation
http://ecx.images-amazon.com/images/I/41xIrhsvXeL.jpg,History Wars: The Enola Gay and Other Battles for the American Past,,History
http://ecx.images-amazon.com/images/I/51QoNibyseL.jpg,The Aesthetics of Thomas Aquinas,Umberto Eco,Politics & Social Sciences
http://ecx.images-amazon.com/images/I/51m1yglY1aL.jpg,The Psychology of Dexter (Psychology of Popular Culture),,Humor & Entertainment
http://ecx.images-amazon.com/images/I/519bFjp%2B7lL.jpg,Improve Mental Toughness in Squash by Using Meditation: Reveal Your True Potential by Controlling Your Inner Thoughts,Joseph Correa (Certified Meditation Instructor),Sports & Outdoors
http://ecx.images-amazon.com/images/I/515GsHoASDL.jpg,Literature for Composition: An Introduction to Literature (10th Edition),Sylvan Barnet,Literature & Fiction
http://ecx.images-amazon.com/images/I/51NE%2BVOoNhL.jpg,Room and Furniture Layout Kit,Muncie Hendler,Arts & Photography
http://ecx.images-amazon.com/images/I/4198fzMBE4L.jpg,The Man Without a Face: The Unlikely Rise of Vladimir Putin,Masha Gessen,Biographies & Memoirs
http://ecx.images-amazon.com/images/I/51UenQLOC-L.jpg,New Beginnings,KC Richardson,Romance
http://ecx.images-amazon.com/images/I/51UmlmPXsrL.jpg,Tolkien : The Illustrated Encyclopaedia,David Day,Reference
http://ecx.images-amazon.com/images/I/61EHKGGZJPL.jpg,Twins!,Elaine Scott,Parenting & Relationships
http://ecx.images-amazon.com/images/I/31LUW97025L.jpg,Maudsley & Burn's Land Law Cases and Materials,John J. Cartwright,Law
http://ecx.images-amazon.com/images/I/51iPki7p5lL.jpg,The Red Dragon & The West Wind: The Winning Guide to Official Chinese & American Mah-Jongg,Tom Sloper,Humor & Entertainment
http://ecx.images-amazon.com/images/I/51tCQEcs3fL.jpg,The Perfect Vehicle: What It Is About Motorcycles,Melissa Holbrook Pierson,Engineering & Transportation
http://ecx.images-amazon.com/images/I/41arwb6sWPL.jpg,The Twilight War: The Secret History of America's Thirty-Year Conflict with Iran,David Crist,History
http://ecx.images-amazon.com/images/I/51UICc%2BuxYL.jpg,Cthulhu Invictus Companion: The Mythos Threatens Ancient Rome (Call of Cthulhu roleplaying),Chad Bowser,Science Fiction & Fantasy
http://ecx.images-amazon.com/images/I/41mxRSqWeML.jpg,Life Lessons: Two Experts on Death and Dying Teach Us About the Mysteries of Life and Living,Elisabeth Kübler-Ross,Self-Help
http://ecx.images-amazon.com/images/I/51UTC3D0hVL.jpg,Glamorous Rooms,Jan Showers,Arts & Photography
http://ecx.images-amazon.com/images/I/51cPAvYM78L.jpg,"Math Workout for the GMAT, 5th Edition (Graduate School Test Preparation)",Princeton Review,Test Preparation
http://ecx.images-amazon.com/images/I/51JKGuwsZWL.jpg,On Boxing,Joyce Carol Oates,Sports & Outdoors
http://ecx.images-amazon.com/images/I/41q8DxzbehL.jpg,The Hard Goodbye (Sin City),Frank Miller,Comics & Graphic Novels
http://ecx.images-amazon.com/images/I/51nmEed7DXL.jpg,Drunken Fireworks,Stephen King,"Mystery, Thriller & Suspense"
http://ecx.images-amazon.com/images/I/51B4G0dy09L.jpg,Digital SLR Video and Filmmaking For Dummies,John Carucci,Arts & Photography
http://ecx.images-amazon.com/images/I/517toR07PuL.jpg,The War of 1812: The War That Both Sides Won,Wesley B. Turner,History
http://ecx.images-amazon.com/images/I/41vyZr%2Bo0QL.jpg,Competition Law,Richard Whish,Law
http://ecx.images-amazon.com/images/I/41fCZaOKJ0L.jpg,Unreliable Memoirs,Clive James,Biographies & Memoirs
http://ecx.images-amazon.com/images/I/61FRLyDcqmL.jpg,Tigers National Geographic 2016 Wall Calendar,National Geographic Society,Calendars
http://ecx.images-amazon.com/images/I/516eRl4AsYL.jpg,Master the Military Flight Aptitude Tests,Peterson's,Test Preparation
http://ecx.images-amazon.com/images/I/51GVEKihpgL.jpg,Power Filmmaking Kit,Jason Tomaric,Humor & Entertainment
http://ecx.images-amazon.com/images/I/51WB7Zqr0pL.jpg,Merriam-Webster's Dictionary and Thesaurus (Turtleback School & Library Binding Edition),Eds. Merriam-Webster,Reference
http://ecx.images-amazon.com/images/I/414IoLKGYnL.jpg,The Divine Milieu (Perennial Classics),Pierre Teilhard de Chardin,Politics & Social Sciences
http://ecx.images-amazon.com/images/I/51WieROZaLL.jpg,Paddling Texas: A Guide to the State's Best Paddling Routes (Paddling Series),Shane Townsend,Sports & Outdoors
http://ecx.images-amazon.com/images/I/51IniG6ynRL.jpg,"Omamori Himari, Vol. 4",,Comics & Graphic Novels
http://ecx.images-amazon.com/images/I/510NGJ2P1XL.jpg,Deaf History Unveiled: Interpretations from the New Scholarship,,Law
http://ecx.images-amazon.com/images/I/51nzfHBZK4L.jpg,Papa's Burlesque House: Growing Up in a Burlesque Theater,Beverly Solomon,Romance
http://ecx.images-amazon.com/images/I/51WP2SVD1WL.jpg,"Nelson's Navy: The Ships, Men, and Organization, 1793-1815",Brian Lavery,History
http://ecx.images-amazon.com/images/I/518ubCpK9GL.jpg,Darkly Dreaming Dexter,Jeff Lindsay,"Mystery, Thriller & Suspense"
http://ecx.images-amazon.com/images/I/51fdiQQfeWL.jpg,Basics of Video Lighting,Des Lyver,Arts & Photography
http://ecx.images-amazon.com/images/I/51Krm-BvP6L.jpg,Civil Procedure Stories (Law Stories),Kevin Clermont,Law
http://ecx.images-amazon.com/images/I/41mH4JwNeYL.jpg,Mira Corpora,Jeff Jackson,Science Fiction & Fantasy
http://ecx.images-amazon.com/images/I/519GbG%2BpcdL.jpg,How to Raise an Adult: Break Free of the Overparenting Trap and Prepare Your Kid for Success,Julie Lythcott-Haims,Parenting & Relationships
http://ecx.images-amazon.com/images/I/51-LzoOXddL.jpg,A Youth Wasted Climbing,David Chaundy-Smart,Sports & Outdoors
http://ecx.images-amazon.com/images/I/51xaV31BzAL.jpg,Fishing in Utopia: Sweden and the Future that Disappeared,Andrew Brown,Biographies & Memoirs
http://ecx.images-amazon.com/images/I/512k5jr2M8L.jpg,"Planet Middle School: Helping Your Child through the Peer Pressure, Awkward Moments & Emotional Drama",Kevin Leman,Self-Help
http://ecx.images-amazon.com/images/I/51DEjZirsXL.jpg,Scar Tissue,Anthony Kiedis,Humor & Entertainment
http://ecx.images-amazon.com/images/I/51zU-lqjz-L.jpg,Speed and Luxury: The Great Cars,Dennis Adler,Engineering & Transportation
http://ecx.images-amazon.com/images/I/51eLPKKJn4L.jpg,Burial Patterns and Cultural Diversity in Late Bronze Age Canaan (Dissertation Series (American Schools of Oriental Research)),Rivka Gonen,History
http://ecx.images-amazon.com/images/I/612PB5GmUDL.jpg,The Living Trust : The Failproof Way to Pass Along Your Estate to Your Heirs,Henry Abts,Law
http://ecx.images-amazon.com/images/I/51Khg-eaFXL.jpg,KIYA: Mother of a King,Katie Hamstead,Romance
http://ecx.images-amazon.com/images/I/61KfjJ5VOTL.jpg,"Dream Spectres: Extreme Ukiyo-e: Sex, Blood, Demons,  Monsters, Ghosts, Tattoo (Ukiyo-e Master Series)",,Arts & Photography
http://ecx.images-amazon.com/images/I/51CIcg%2Bq-yL.jpg,Master the Civil Service Exams,Peterson's,Test Preparation
http://ecx.images-amazon.com/images/I/51aw00-8Q%2BL.jpg,The Big Book of Beastly Mispronunciations: The Complete Opinionated Guide for the Careful Speaker,Charles Harrington Elster,Reference
http://ecx.images-amazon.com/images/I/41MVH5WRnSL.jpg,My Lucky Life In and Out of Show Business: A Memoir,Dick Van Dyke,Humor & Entertainment
http://ecx.images-amazon.com/images/I/51ZWyoZoJfL.jpg,Searching for Whitopia: An Improbable Journey to the Heart of White America,Rich Benjamin,Politics & Social Sciences
http://ecx.images-amazon.com/images/I/511cWiIIj9L.jpg,The Guide to Assisting Students With Disabilities: Equal Access in Health Science and Professional Education,Lisa Meeks,Law
http://ecx.images-amazon.com/images/I/51QG2ddk-PL.jpg,"Spice & Wolf, Vol. 6",Isuna Hasekura,Comics & Graphic Novels
http://ecx.images-amazon.com/images/I/51JJHuTclXL.jpg,The Greater Journey: Americans in Paris,David McCullough,History
http://ecx.images-amazon.com/images/I/513swjFUZFL.jpg,Fender® Custom Shop Guitar 2016 Mini Calendar,Fender Guitar,Calendars
http://ecx.images-amazon.com/images/I/51idzeWPmZL.jpg,Capelle's Practicing Pool,Phil Capelle,Sports & Outdoors
http://ecx.images-amazon.com/images/I/51Dk0qNcV6L.jpg,The Manager's Legal Handbook,Amy DelPo,Law
http://ecx.images-amazon.com/images/I/51Nxd33o2FL.jpg,Be Fruitful: The Essential Guide to Maximizing Fertility and Giving Birth to a Healthy Child,MD Victoria Maizes,Parenting & Relationships
http://ecx.images-amazon.com/images/I/41q-4TPLi8L.jpg,"The Ascendancy of the Scientific Dictatorship: An Examination of Epistemic Autocracy, From the 19th to the 21st Century",Paul Collins,Politics & Social Sciences
http://ecx.images-amazon.com/images/I/51h7go1%2BqyL.jpg,Mona Hatoum,Cristina Zelich,Arts & Photography
http://ecx.images-amazon.com/images/I/51dU1i1%2BAiL.jpg,Boyd: The Fighter Pilot Who Changed the Art of War,Robert Coram,Biographies & Memoirs
http://ecx.images-amazon.com/images/I/41rZENSFfiL.jpg,"Etty Hillesum: An Interrupted Life the Diaries, 1941-1943 and Letters from Westerbork",Etty Hillesum,History
