url,name,author,category
http://ecx.images-amazon.com/images/I/5193Q0EYJZL.jpg,Murder at Hockey Camp (Screech Owls Series #4),Roy MacGregor,Children's Books
http://ecx.images-amazon.com/images/I/51tKW-YQ-TL.jpg,"Balance Your Hormones, Balance Your Life: Achieving Optimal Health and Wellness through Ayurveda, Chinese Medicine, and Western Science",Claudia Welch,"Health, Fitness & Dieting"
http://ecx.images-amazon.com/images/I/41NFlWWQVmL.jpg,The Pleasures of Your Food Processor,Norene Gilletz,"Cookbooks, Food & Wine"
http://ecx.images-amazon.com/images/I/51e2Gzhca8L.jpg,Mother of the Buddhas: Meditations on the Prajnaparamita Sutra,Lex Hixon,Religion & Spirituality
http://ecx.images-amazon.com/images/I/51XPhTEEWnL.jpg,Fourteen Families in Pueblo Pottery,Rick Dillingham,"Crafts, Hobbies & Home"
http://ecx.images-amazon.com/images/I/51zX7Jp1VxL.jpg,Where to Start and What to Ask: An Assessment Handbook,Susan Lukas,Medical Books
http://ecx.images-amazon.com/images/I/21DPZF2Q7AL.jpg,The Majesty of Natchez (Majesty Architecture),Reid Smith,Travel
http://ecx.images-amazon.com/images/I/51Gv15UYtrL.jpg,Kindle 3 For Dummies,Harvey R. Chute,Computers & Technology
http://ecx.images-amazon.com/images/I/51oFbkeOACL.jpg,"Denying Evolution: Creationism, Scientism, and the Nature of Science",Massimo Pigliucci,Christian Books & Bibles
http://ecx.images-amazon.com/images/I/3165BIRxy0L.jpg,"Deposition Handbook, Fifth Edition",Dennis R. Suplee,Law
http://ecx.images-amazon.com/images/I/61uU2GVaAJL.jpg,The Physics of Superheroes: Spectacular Second Edition,James Kakalios,Comics & Graphic Novels
http://ecx.images-amazon.com/images/I/51uMjJI%2BeVL.jpg,The Green,Troon McAllister,Literature & Fiction
http://ecx.images-amazon.com/images/I/51zqEdn4toL.jpg,The Moundbuilders: Ancient Peoples of Eastern North America (Ancient Peoples and Places),George R. Milner,History
http://ecx.images-amazon.com/images/I/31B8ys83hyL.jpg,The Dancing Dragon,Marcia K. Vaughan,Children's Books
http://ecx.images-amazon.com/images/I/61cuQxXSI-L.jpg,"Her Prairie Viking: Prairie Brides, Book Four",Kit Morgan,Romance
http://ecx.images-amazon.com/images/I/41hBzh5j0BL.jpg,Historical Dictionary of Bowling (Historical Dictionaries of Sports),John Grasso,Sports & Outdoors
http://ecx.images-amazon.com/images/I/41PTpvXwcUL.jpg,Eileen Gray: Her Life and Her Work. The Ultimate Biography,Peter Adam,Arts & Photography
http://ecx.images-amazon.com/images/I/51T13G1833L.jpg,"Manating the School Age Child with a Chronic Health Condition (A Practical Guide for Schools, Families and Organizations)",Georgianna Larson,"Health, Fitness & Dieting"
http://ecx.images-amazon.com/images/I/41VAQTxVtlL.jpg,Cognitive Therapy for Suicidal Patients: Scientific and Clinical Applications,Amy Wenzel,Self-Help
http://ecx.images-amazon.com/images/I/411wGRoEvLL.jpg,Mathematics for Business (10th Edition),Stanley A. Salzman,Business & Money
http://ecx.images-amazon.com/images/I/51zudkX0vIL.jpg,"GD LODGING IN ITALY'S MONASTERIES, 3rd (Guide to Lodging in Italy's Monasteries)",First Last,Travel
http://ecx.images-amazon.com/images/I/51piXN8acqL.jpg,Handbook of Vertebrate Immunology,,Medical Books
http://ecx.images-amazon.com/images/I/51-%2BWxhZboL.jpg,Kiss of God: The Wisdom of a Silent Child,Marshall Stewart Ball,Children's Books
http://ecx.images-amazon.com/images/I/51j0jmGUBoL.jpg,Why Men Marry Bitches: A Woman's Guide to Winning Her Man's Heart,Sherry Argov,Parenting & Relationships
http://ecx.images-amazon.com/images/I/51j64iOMDWL.jpg,Philip Treacy: Hat Designer,Philip Treacy,Humor & Entertainment
http://ecx.images-amazon.com/images/I/51xmA%2B5RrbL.jpg,The Rhythm of Life: Living Every Day with Passion and Purpose,Matthew Kelly,Christian Books & Bibles
http://ecx.images-amazon.com/images/I/51wen026pFL.jpg,Batman Collectables,Rob Burman,"Crafts, Hobbies & Home"
http://ecx.images-amazon.com/images/I/51XQy1hiUyL.jpg,"The Put 'em Up! Preserving Answer Book: 399 Solutions to All Your Questions: Canning, Freezing, Drying, Fermenting, Making Infusions",Sherri Brooks Vinton,"Cookbooks, Food & Wine"
http://ecx.images-amazon.com/images/I/410HZE7J7JL.jpg,Introduction to Oil Company Financial Analysis,David Johnston,Business & Money
http://ecx.images-amazon.com/images/I/51kQbwb-3GL.jpg,"The Country Boy Killer : The True Story of Cody Legebokoff,  Canada's Teenage Serial Killer (Crimes Canada: True Crimes That Shocked the Nation) (Volume 6)",JT Hunter,Biographies & Memoirs
http://ecx.images-amazon.com/images/I/51jfzHSyahL.jpg,Die Sippe der Frauen (Die Steinzeit-Trilogie 3) (German Edition),Anna Kien,Teen & Young Adult
http://ecx.images-amazon.com/images/I/51IVj4ShwVL.jpg,Beyond Heroes: A Lean Management System for Healthcare,Kim Barnas,Medical Books
http://ecx.images-amazon.com/images/I/51PJu5FagvL.jpg,"Light of Eidon (Legends of the Guardian-King, Book 1)",Karen Hancock,Religion & Spirituality
http://ecx.images-amazon.com/images/I/51Tug2abxeL.jpg,"Theology of the Body for Beginners: A Basic Introduction to Pope John Paul II's Sexual Revolution, Revised Edition",Christopher West,Computers & Technology
http://ecx.images-amazon.com/images/I/51zzyZGGLmL.jpg,The Philosopher's Stone: Alchemy and the Secret Research for Exotic Matter,Joseph P. Farrell,Science & Math
http://ecx.images-amazon.com/images/I/61y32-%2B1qdL.jpg,The Most Beautiful Universities in the World,Jean Serroy,Arts & Photography
http://ecx.images-amazon.com/images/I/410j-ufagpL.jpg,The Natural,Bernard Malamud,Science Fiction & Fantasy
http://ecx.images-amazon.com/images/I/5118RBE3KNL.jpg,Almost Everything,Joelle Jolivet,Reference
http://ecx.images-amazon.com/images/I/51uaepIvCLL.jpg,Practical Mixed-Media Printmaking,Sarah Riley,"Crafts, Hobbies & Home"
http://ecx.images-amazon.com/images/I/31apvG651rL.jpg,Elbow Room: The Varieties of Free Will Worth Wanting,Daniel C. Dennett,Politics & Social Sciences
http://ecx.images-amazon.com/images/I/51za8debSGL.jpg,Am I small? Ego sum parva?: Children's Picture Book English-Latin (Bilingual Edition/Dual Language),Philipp Winterberg,Children's Books
http://ecx.images-amazon.com/images/I/51%2BnR9lJsLL.jpg,"Tea Time in Sri Lanka: Photos from the Dambatenne Tea Garden, Lipton's Seat and a Ceylon Tea Factory",Marketa Palatin,Travel
http://ecx.images-amazon.com/images/I/519wv5upt8L.jpg,Wilton Decorating Cakes Book,,"Cookbooks, Food & Wine"
http://ecx.images-amazon.com/images/I/411Tp5w7e7L.jpg,Inese Galante: Pec neskaitamam sarunam ar makslinieci gramatu uzrakstijusi Silvija Lice,Silvija Lice,"Health, Fitness & Dieting"
http://ecx.images-amazon.com/images/I/41jAXLPeavL.jpg,Equine Dentistry: A Practical Guide,Patricia Pence,Medical Books
http://ecx.images-amazon.com/images/I/41C8RlMklxL.jpg,Moorish/Muurish Treaties: Guide to Treaties and Declarations,Bandele Yobachi El-Amin,History
http://ecx.images-amazon.com/images/I/51RJ1LZ017L.jpg,"Chronic Youth: Disability, Sexuality, and U.S. Media Cultures of Rehabilitation (NYU Series in Social and Cultural Analysis)",Julie Passanante Elman,Law
http://ecx.images-amazon.com/images/I/51WPM6Z3YAL.jpg,Slap Jack Card Game,Us Games Systems,Humor & Entertainment
http://ecx.images-amazon.com/images/I/41-EJqGRw1L.jpg,Brightest Heaven of Invention: A Christian Guide To Six Shakespeare Plays,Peter J. Leithart,Literature & Fiction
http://ecx.images-amazon.com/images/I/61E88XwK0hL.jpg,Field & Stream Skills Guide: Camping (Field & Streams Total Outdoorsman Challenge),T. Edward Nickens,Sports & Outdoors
http://ecx.images-amazon.com/images/I/51OaIl85XxL.jpg,Printing Our Way to Poverty: The Consequences of American Inflation,Mr. Pat McGeehan,Business & Money
http://ecx.images-amazon.com/images/I/51IvRENtYiL.jpg,Help! I'm a Volunteer Youth Worker,Doug Fields,Religion & Spirituality
http://ecx.images-amazon.com/images/I/41ji9myWt2L.jpg,"Small Is Big, Slow Is Fast: Living and Leading Your Family and Community on God's Mission",Caesar Kalinowski,Christian Books & Bibles
http://ecx.images-amazon.com/images/I/61EEE2CMA2L.jpg,The Magpies' Nest,Joanna Foster,Children's Books
http://ecx.images-amazon.com/images/I/51lYsRgvb9L.jpg,"Tel Aviv: Mythography of a City (Space, Place and Society)",Maoz Azaryahu,Travel
http://ecx.images-amazon.com/images/I/51Ky0KHL4xL.jpg,Arduino: A Quick-Start Guide,Maik Schmidt,Computers & Technology
http://ecx.images-amazon.com/images/I/51ZOFNuK0OL.jpg,Single Digits: In Praise of Small Numbers,Marc Chamberland,Science & Math
http://ecx.images-amazon.com/images/I/51MbAZCBC5L.jpg,Pediatric Sleep Problems: A Clinician's Guide to Behavioral Interventions,Lisa J. Meltzer,"Health, Fitness & Dieting"
http://ecx.images-amazon.com/images/I/51vWtfjKGXL.jpg,"Doing Business with Germans: Their Perception, Our Perception",Sylvia Schroll-Machl,Business & Money
http://ecx.images-amazon.com/images/I/51Id0SwVhlL.jpg,Constructing Shadows,,"Crafts, Hobbies & Home"
http://ecx.images-amazon.com/images/I/51VXH3BT2cL.jpg,How to Talk to Girls,Jonathan Toussaint,Teen & Young Adult
http://ecx.images-amazon.com/images/I/41sNE1atYYL.jpg,German Vocabulary (Academic),Inc. BarCharts,Reference
http://ecx.images-amazon.com/images/I/51hbWPUhMLL.jpg,The New Ghost (Nobrow 17x23),Robert Hunter,Comics & Graphic Novels
http://ecx.images-amazon.com/images/I/51KVGA7GDHL.jpg,Osseointegration in Dentistry: An Overview,Philip Worthington,Medical Books
http://ecx.images-amazon.com/images/I/51sAX-EsVkL.jpg,1001+ Basic Phrases English - Telugu,Gilad Soffer,Travel
http://ecx.images-amazon.com/images/I/41B-MHLiA8L.jpg,Mariner's Book of Days 2011,Peter H. Spectre,Calendars
http://ecx.images-amazon.com/images/I/513TS89pBiL.jpg,DCS Ship Book 2 (DCS Roleplay),Jeff Coplen,Science Fiction & Fantasy
http://ecx.images-amazon.com/images/I/31esXvhbgEL.jpg,Dr. Atkin's Diet Revolution,Robert C. Atkins,"Health, Fitness & Dieting"
http://ecx.images-amazon.com/images/I/413ixZGkpLL.jpg,A Teacher's Pocket Guide to School Law (3rd Edition) (Allyn & Bacon Educational Leadership),Nathan L. Essex,Law
http://ecx.images-amazon.com/images/I/618JK4ESi0L.jpg,Blackjack Attack: Playing the Pros' Way,Don Schlesinger,Humor & Entertainment
http://ecx.images-amazon.com/images/I/5111JSgIgyL.jpg,"Politics and Society in Saudi Arabia: The Crucial Years of Development, 1960-1982",Sarah Yizraeli,History
http://ecx.images-amazon.com/images/I/51OYVrlXHoL.jpg,The Weird Sisters,Eleanor Brown,Literature & Fiction
http://ecx.images-amazon.com/images/I/51QLBvKzf2L.jpg,The Butterflies of North America: Titian Peale's Lost Manuscript,Kenneth Haltman,Arts & Photography
http://ecx.images-amazon.com/images/I/51NRTa97XaL.jpg,The Everything Pressure Cooker Cookbook,Pamela Rice Hahn,"Cookbooks, Food & Wine"
http://ecx.images-amazon.com/images/I/5181TIt1kML.jpg,"Cranes, Dump Trucks, Bulldozers: and Other Building Machines (How Things Work)",Terry J. Jennings,Children's Books
http://ecx.images-amazon.com/images/I/5123fSWgtDL.jpg,The Little Gold Grammar Book: 40 Powerful Rules for Clear and Correct Writing,Brandon Royal,Test Preparation
http://ecx.images-amazon.com/images/I/41oGlL3LbVL.jpg,"A Wedding Like No Other: Inspiration for Creating a Unique, Personal, and Unforgettable Celebration",Peggy Post,"Crafts, Hobbies & Home"
http://ecx.images-amazon.com/images/I/41uNj3n3gWL.jpg,"The Soul of Discipline: The Simplicity Parenting Approach to Warm, Firm, and Calm Guidance- From Toddlers to Teens",Kim John Payne,Parenting & Relationships
http://ecx.images-amazon.com/images/I/512C3NMT6HL.jpg,Is the Reformation Over?: An Evangelical Assessment of Contemporary Roman Catholicism,Mark A. Noll,Christian Books & Bibles
http://ecx.images-amazon.com/images/I/51sKRB20uAL.jpg,"Radar and ARPA Manual, Third Edition: Radar, AIS and Target Tracking for Marine Radar Users",Alan G. Bole,Engineering & Transportation
http://ecx.images-amazon.com/images/I/416fdMgFdHL.jpg,The Origins of Attachment: Infant Research and Adult Treatment (Relational Perspectives Book Series),Beatrice Beebe,Medical Books
http://ecx.images-amazon.com/images/I/51ufPcv3-PL.jpg,The Korean Mind: Understanding Contemporary Korean Culture,Boye Lafayette De Mente,Business & Money
http://ecx.images-amazon.com/images/I/41YeyaL-OFL.jpg,Dancing on the Edge,Jack Stevens,Romance
http://ecx.images-amazon.com/images/I/51qGa2%2BJHKL.jpg,Mexico (National Geographic Adventure Map),National Geographic Maps - Adventure,Travel
http://ecx.images-amazon.com/images/I/51PH3-SsFiL.jpg,Houghton Mifflin Reading: Student Edition Grade 1.3 Surprises 2005,HOUGHTON MIFFLIN,Children's Books
http://ecx.images-amazon.com/images/I/51BMWbLTSSL.jpg,The Transatlantic Conspiracy,G. D. Falksen,Teen & Young Adult
http://ecx.images-amazon.com/images/I/41zYfFOdVOL.jpg,A Natural Woman: A Memoir,Carole King,Biographies & Memoirs
http://ecx.images-amazon.com/images/I/51hAlb8l1CL.jpg,Kitchen Cures: Homemade Remedies for Your Health,Editors of Reader's Digest,"Health, Fitness & Dieting"
http://ecx.images-amazon.com/images/I/51j6DbdyJzL.jpg,Scientific and Clinical Applications of Magnetic Carriers,,Science & Math
http://ecx.images-amazon.com/images/I/51MsnD-sftL.jpg,Basic Statistics for the Health Sciences,Jan Kuzma,Medical Books
http://ecx.images-amazon.com/images/I/51CRaj9uQdL.jpg,Tiffany Lamps and Metalware: An Illustrated Reference to Over 2000 Models,Alastair Duncan,"Crafts, Hobbies & Home"
http://ecx.images-amazon.com/images/I/51AhzTV6WFL.jpg,The Pashtun Question: The Unresolved Key to the Future    of Pakistan and Afghanistan,Abubakar Siddique,History
http://ecx.images-amazon.com/images/I/41SjJWji2sL.jpg,Oracle Database 11g SQL (Oracle Press),Jason Price,Computers & Technology
http://ecx.images-amazon.com/images/I/41Da-MMH2uL.jpg,"A Relationship Restored:: Trends in U.S.-China Educational Exchanges, 1978-1984","The Committee on Scholarly Communication with the People's Republic
of China",Travel
http://ecx.images-amazon.com/images/I/51ykhI2NpXL.jpg,Sit 'n Go Strategy,Collin Moshman,Humor & Entertainment
http://ecx.images-amazon.com/images/I/51qv7n%2B3ZxL.jpg,Romeo and Juliet for Kids (Shakespeare Can Be Fun!),Lois Burdett,Literature & Fiction
http://ecx.images-amazon.com/images/I/518k5q1%2BjFL.jpg,The House of Morgan: An American Banking Dynasty and the Rise of Modern Finance,Ron Chernow,Business & Money
http://ecx.images-amazon.com/images/I/412wau-BYkL.jpg,Andrology for the Clinician,,"Health, Fitness & Dieting"
http://ecx.images-amazon.com/images/I/51IL16VNTEL.jpg,"Basic Psychic Development: A User's Guide to Auras, Chakras & Clairvoyance",John Friedlander,Religion & Spirituality
http://ecx.images-amazon.com/images/I/51vhMFYLFXL.jpg,Cooking Light First Foods: Baby Steps to a Lifetime of Healthy Eating,Editors of Cooking Light Magazine,"Cookbooks, Food & Wine"
http://ecx.images-amazon.com/images/I/51A4rMGlD3L.jpg,The Penguin Atlas of Women in the World: Fourth Edition,Joni Seager,Reference
http://ecx.images-amazon.com/images/I/51trxzX-BML.jpg,Polio: An American Story,David M. Oshinsky,Medical Books
http://ecx.images-amazon.com/images/I/41eMJDXcaTL.jpg,The Language of Bribery Cases (Oxford Studies in Language and Law),Roger W. Shuy,Law
http://ecx.images-amazon.com/images/I/61yLkyr3kDL.jpg,The Classic Tales of Brer Rabbit,Joel Chandler Harris,Children's Books
http://ecx.images-amazon.com/images/I/41AOa6pgltL.jpg,Fundamentals of Radiation Chemistry,A. Mozumder,Science & Math
http://ecx.images-amazon.com/images/I/51LfZWOHrAL.jpg,"The Twilight Saga: The Complete Film Archive: Memories, Mementos, and Other Treasures from the Creative Team Behind the Beloved Motion Pictures",Robert Abele,Teen & Young Adult
http://ecx.images-amazon.com/images/I/51zVoCxhA4L.jpg,Shadow of My Father,John A. Gotti,Biographies & Memoirs
http://ecx.images-amazon.com/images/I/51VBAGe6vPL.jpg,"Teen Health, Course 1, Student Edition",McGraw-Hill Education,"Health, Fitness & Dieting"
http://ecx.images-amazon.com/images/I/51B5G80%2Br5L.jpg,"American Map Cape Cod, MA Street Atlas",,Travel
http://ecx.images-amazon.com/images/I/51uSRb4-27L.jpg,The Change Leader's Roadmap: How to Navigate Your Organization's Transformation,Linda Ackerman Anderson,Business & Money
http://ecx.images-amazon.com/images/I/51B9sZtXApL.jpg,Capitol Revolution: The Rise of the McMahon Wrestling Empire,Tim Hornbaker,Sports & Outdoors
http://ecx.images-amazon.com/images/I/611YJMP5A4L.jpg,Classic American Folk Tales (Children's classics),Steven Zorn,Children's Books
http://ecx.images-amazon.com/images/I/4131y0HLoYL.jpg,How to Develop a Super Power Memory,Harry Lorayne,Self-Help
http://ecx.images-amazon.com/images/I/41eeCxjaewL.jpg,The Summer Book (New York Review Books Classics),Tove Jansson,Literature & Fiction
http://ecx.images-amazon.com/images/I/51C4Vj4rRbL.jpg,"A Paramedic's Story: Life, Death, and Everything in Between","Steven ""Kelly"" Grayson",Medical Books
http://ecx.images-amazon.com/images/I/51c3jIhc6nL.jpg,"A treatise on the legal remedies of mandamus and prohibition, habeas corpus, certiorari and quo warranto",H G. 1831-1893 Wood,Law
http://ecx.images-amazon.com/images/I/51mP8xrQL2L.jpg,The Samurai Invasion of Korea 1592-98 (Campaign),Stephen Turnbull,History
http://ecx.images-amazon.com/images/I/41nyMP0LB-L.jpg,Shakespeare's Secret Booke: Deciphering Magical and Rosicrucian Codes,David Ovason,Religion & Spirituality
http://ecx.images-amazon.com/images/I/51i4%2Bd6BooL.jpg,Independence: A Guide to Historic Philadelphia,George W. Boudreau,Travel
http://ecx.images-amazon.com/images/I/51q8X7nSd5L.jpg,Stop Motion Animation: How to Make & Share Creative Videos,Melvyn Ternan,Arts & Photography
http://ecx.images-amazon.com/images/I/51u8tHwobRL.jpg,A Year with Mary: Daily Meditations on the Mother of God,Paul Thigpen Ph.D.,Christian Books & Bibles
http://ecx.images-amazon.com/images/I/51IbqrkFRFL.jpg,Requirements Modelling and Specification for Service Oriented Architecture,Ian Graham,Computers & Technology
http://ecx.images-amazon.com/images/I/51re4rdOmKL.jpg,"McGraw-Hill's SSAT/ISEE: Secondary School Admission Test, Independent School Entrance Exam",Nicholas Falletta,Test Preparation
http://ecx.images-amazon.com/images/I/51M-EyTNmvL.jpg,The Gangster (An Isaac Bell Adventure),Clive Cussler,"Mystery, Thriller & Suspense"
http://ecx.images-amazon.com/images/I/51hCsIYb-mL.jpg,The Rhythm of Family: Discovering a Sense of Wonder through the Seasons,Amanda Blake Soule,"Crafts, Hobbies & Home"
http://ecx.images-amazon.com/images/I/51qOwnlec1L.jpg,The Power of Babel: A Natural History of Language,John McWhorter,Politics & Social Sciences
http://ecx.images-amazon.com/images/I/51NmzHNddxL.jpg,Parkinson's Disease and Movement Disorders,Dr. Joseph Jankovic  MD,"Health, Fitness & Dieting"
http://ecx.images-amazon.com/images/I/514zJr%2B9f2L.jpg,River Road Recipes: The Textbook of Louisiana Cuisine,Junior League of Baton Rouge,"Cookbooks, Food & Wine"
http://ecx.images-amazon.com/images/I/61ZXXTPDKQL.jpg,"2006 Country Profile and Guide to Zambia:  National Travel Guidebook and Handbook:  USAID Reports, Water Use, Law, Energy, AGOA (Two CD-ROM Set)",U.S. Government,Travel
http://ecx.images-amazon.com/images/I/51QbnlPQf3L.jpg,Gone,Michael Grant,Teen & Young Adult
http://ecx.images-amazon.com/images/I/510pGZ8VrqL.jpg,Swimming with the Sharps: A Football Season Spent in Las Vegas,David McIntire,Humor & Entertainment
http://ecx.images-amazon.com/images/I/513DySrw8IL.jpg,Prison Island: A Graphic Memoir,Ms. Colleen Frakes,Comics & Graphic Novels
http://ecx.images-amazon.com/images/I/51GIZRkbkZL.jpg,Ghost Liners: Exploring the World's Greatest Lost Ships,Robert Ballard,Children's Books
http://ecx.images-amazon.com/images/I/517NZvlFBHL.jpg,Footfall,Larry Niven,Science Fiction & Fantasy
http://ecx.images-amazon.com/images/I/21KEA408D0L.jpg,Lippincott Manual of Nursing Practice,Sandra M. Nettina MSN  ANP-BC,Medical Books
http://ecx.images-amazon.com/images/I/41HvayX2%2BML.jpg,Industrial Organic Chemistry,Hans-Jürgen Arpe,Science & Math
http://ecx.images-amazon.com/images/I/7174TK6DWNL.gif,Winning Hockey (Spalding Sports Library),Bob Cielo,Sports & Outdoors
http://ecx.images-amazon.com/images/I/51tba1q6MDL.jpg,Cuentos de Amor de Locura y de Muerte,Horacio Quiroga,Literature & Fiction
http://ecx.images-amazon.com/images/I/618F2ENR4PL.jpg,Where in the World ? An Atlas for Stamp Collectors,Kenneth A. Wood,"Crafts, Hobbies & Home"
http://ecx.images-amazon.com/images/I/51XyKh8PCML.jpg,"Predictive Analytics, Data Mining and Big Data: Myths, Misconceptions and Methods (Business in the Digital Economy)",Steven Finlay,Business & Money
http://ecx.images-amazon.com/images/I/512rCnNh2yL.jpg,Speer: Hitler's Architect,Martin Kitchen,History
http://ecx.images-amazon.com/images/I/51MuIBkUATL.jpg,Tao Te Ching: A New Translation with Commentary,,Religion & Spirituality
http://ecx.images-amazon.com/images/I/41XWctmjptL.jpg,"Somali-English, English-Somali Dictionary and Phrasebook (Hippocrene Dictionary & Phrasebook)",C. Quadir,Travel
http://ecx.images-amazon.com/images/I/61OPk2A9eQL.jpg,My First Numbers Coloring Book 1 (Volume 1),Nick Snels,Parenting & Relationships
http://ecx.images-amazon.com/images/I/51QG8FPL2KL.jpg,The Case for the Resurrection of Jesus,Gary R. Habermas,Christian Books & Bibles
http://ecx.images-amazon.com/images/I/51RndGJFGXL.jpg,The Olympics: Legendary Sports Events (Matt Christopher Legendary Sports Events),Matt Christopher,Children's Books
http://ecx.images-amazon.com/images/I/51hosnR83yL.jpg,Effective Birth Preparation (Hospital or Birth Centre): Self Hypnosis (Natal Hypnotherapy Programme),Maggie Howell,"Health, Fitness & Dieting"
http://ecx.images-amazon.com/images/I/510xJ9RhjwL.jpg,LTE for Public Safety,Rainer Liebhart,"Crafts, Hobbies & Home"
http://ecx.images-amazon.com/images/I/41W%2B6Ia4GAL.jpg,Primer for Movement Description Using Effort/Shape,Cecily Dell,Humor & Entertainment
http://ecx.images-amazon.com/images/I/51NHVkNj-sL.jpg,"DREHER-RAD 8 ÁEsterreich, Liechtenstein, Schweiz: ""atur und Kultur mit dem Fahrrad erleben"" - Radtouren im deutschsprachigen Raum (German Edition).",Eberhard Dreher,Travel
http://ecx.images-amazon.com/images/I/51eDu2igfgL.jpg,Only Enchanting (Survivor's Club),Mary Balogh,Romance
http://ecx.images-amazon.com/images/I/51V4OA01d5L.jpg,"An Introduction to Pharmaceutical Sciences: Production, Chemistry, Techniques and Technology (Woodhead Publishing Series in Biomedicine)",Jiben Roy,Business & Money
http://ecx.images-amazon.com/images/I/51fu6-Y3WbL.jpg,The Law of Securities Regulation (Hornbook),Thomas Hazen,Law
http://ecx.images-amazon.com/images/I/515VPK72HRL.jpg,Orfe,Cynthia Voigt,Teen & Young Adult
http://ecx.images-amazon.com/images/I/51irNC71a2L.jpg,Microsoft SharePoint Designer 2010 Step by Step,Penelope Coventry,Computers & Technology
http://ecx.images-amazon.com/images/I/51vVCEE8eIL.jpg,A Christmas Carol,Charles Dickens,Literature & Fiction
http://ecx.images-amazon.com/images/I/51BWfrxVOXL.jpg,Aeromedical Transportation: A Clinical Guide,Terence Martin,Medical Books
http://ecx.images-amazon.com/images/I/21hBldghntL.jpg,Kwanzaa: Why We Celebrate It the Way We Do (Celebrate! (Capstone)),Hintz,Children's Books
http://ecx.images-amazon.com/images/I/512ogr3W-rL.jpg,Lonely Planet Swahili Phrasebook & Dictionary,Lonely Planet,Travel
http://ecx.images-amazon.com/images/I/517Qg94vevL.jpg,Fantasy Bound,Steve O Reno,Arts & Photography
http://ecx.images-amazon.com/images/I/51SozTeg2dL.jpg,"Eat to Get Younger: Tackling inflammation and other ageing processes for a longer, healthier life",Christine Bailey,"Health, Fitness & Dieting"
http://ecx.images-amazon.com/images/I/51VvlTSUKZL.jpg,Mental Toughness Training for Volleyball: Using Visualization to Reach Your True Potential,Joseph Correa (Certified Meditation Instructor),Sports & Outdoors
http://ecx.images-amazon.com/images/I/41zYUxotT7L.jpg,Justifying Genocide: Germany and the Armenians from Bismarck to Hitler,Stefan Ihrig,History
http://ecx.images-amazon.com/images/I/51PTki%2B8PHL.jpg,Thomas Guide: San Bernardino & Riverside Counties Street Guide,Rand McNally,Reference
http://ecx.images-amazon.com/images/I/519EVotPr6L.jpg,The Art of Modeling Chocolate,Nadia  Flecha Guazo,"Cookbooks, Food & Wine"
http://ecx.images-amazon.com/images/I/41AHfnjxwcL.jpg,Ziad Antar: Portrait of a Territory,Christine Macel,Travel
http://ecx.images-amazon.com/images/I/41GyDaZvoaL.jpg,Guidelines for Safe Process Operations and Maintenance,CCPS (Center for Chemical Process Safety),Science & Math
http://ecx.images-amazon.com/images/I/51zK5oj%2BqRL.jpg,Mini Farming: Self-Sufficiency on 1/4 Acre,Brett L. Markham,"Crafts, Hobbies & Home"
http://ecx.images-amazon.com/images/I/41U6Ou56zhL.jpg,A History of the Canonical Literature of the Jainas As,Hiralal Rasikdas Kapadia,Religion & Spirituality
http://ecx.images-amazon.com/images/I/51kTIlXatRL.jpg,Daughter of Smoke & Bone (Daughter of Smoke and Bone),Laini Taylor,Teen & Young Adult
http://ecx.images-amazon.com/images/I/51VH4DA4TRL.jpg,My Divali (Little Nippers: Festivals),Monica Hughes,Children's Books
http://ecx.images-amazon.com/images/I/51r7Ghe9maL.jpg,Malcolm X: A Life of Reinvention,Manning Marable,Biographies & Memoirs
http://ecx.images-amazon.com/images/I/51DABFF9dOL.jpg,DBT Made Simple: A Step-by-Step Guide to Dialectical Behavior Therapy (The New Harbinger Made Simple Series),Sheri Van Dijk MSW,Medical Books
http://ecx.images-amazon.com/images/I/41kxYRayLnL.jpg,Through Western Eyes: Eastern Orthodoxy:  A Reformed Perspective,Robert Letham,Christian Books & Bibles
http://ecx.images-amazon.com/images/I/417DgoqJ3xL.jpg,"Paradigms for a Metaphorology (Signale: Modern German Letters, Cultures, and Thought)",Hans Blumenberg,Politics & Social Sciences
http://ecx.images-amazon.com/images/I/517FptIKI7L.jpg,Freedom of Expression in the Marketplace of Ideas,Douglas Fraleigh,Law
http://ecx.images-amazon.com/images/I/611s2OSSkqL.jpg,Fractal Cosmos 2016 Wall Calendar,Alice Kelley,Calendars
http://ecx.images-amazon.com/images/I/51ASfYyYZfL.jpg,A Woman in the Polar Night,Christiane Ritter,Travel
