url,name,author,category
http://ecx.images-amazon.com/images/I/4139M8F2DML.jpg,The House of Belonging,David Whyte,Literature & Fiction
http://ecx.images-amazon.com/images/I/516YVhu0uRL.jpg,Tarascon Internal Medicine & Critical Care Pocketbook,Robert J. Lederman,Reference
http://ecx.images-amazon.com/images/I/41WnhS7rDSL.jpg,Game-Changing Strategies: How to Create New Market Space in Established Industries by Breaking the Rules,Constantinos C. Markides,Business & Money
http://ecx.images-amazon.com/images/I/41Rh3HtV5ML.jpg,A Lifetime Companion to the Laws of Jewish Family Life,Deena R. Zimmerman MD  MPh  IBCLC,Religion & Spirituality
http://ecx.images-amazon.com/images/I/41s06Kp1TfL.jpg,Invoking Your Celestial Guardians,Solara,Self-Help
http://ecx.images-amazon.com/images/I/61aivXPmj4L.jpg,Rainbow HAND Reflexology/ Acupressure Massage Chart,Yshkeyna Hamilla,"Health, Fitness & Dieting"
http://ecx.images-amazon.com/images/I/41ICFbvro7L.jpg,"Health Care Administration: Managing Organized Delivery Systems, 5th Edition",Lawrence F. Wolper,Medical Books
http://ecx.images-amazon.com/images/I/61Rn7FqcqAL.jpg,Shadowrun Unwired (Shadowrun (Catalyst Hardcover)),Catalyst Game Labs,Science Fiction & Fantasy
http://ecx.images-amazon.com/images/I/51SH461A2VL.jpg,Matchbox Toys: The Tyco Years 1993-1994 (A Schiffer Book for Collectors),Charlie MacK,"Crafts, Hobbies & Home"
http://ecx.images-amazon.com/images/I/41RZzoy3GhL.jpg,It Must've Been Something I Ate,Jeffrey Steingarten,Humor & Entertainment
http://ecx.images-amazon.com/images/I/41-bFVM1q6L.jpg,The Man Who Quit Money,Mark Sundeen,Science & Math
http://ecx.images-amazon.com/images/I/51BCDMF2W0L.jpg,The Six-Spoke Approach to Golf,Tom Patri,Sports & Outdoors
http://ecx.images-amazon.com/images/I/51G7Yp-4YRL.jpg,David Stark: The Art of the Party,David Stark,"Cookbooks, Food & Wine"
http://ecx.images-amazon.com/images/I/51%2BKPM5R9KL.jpg,"Diary Of A 12 Inch Brotha!: ""The Ruler is Back"" (12 Inch Brotha Trilogy) (Volume 1)",Dante' Feenix,Romance
http://ecx.images-amazon.com/images/I/61aNr2lNh5L.jpg,Adult Coloring Book: Coloring Books for Adults : Stress Relieving Patterns (Volume 10),Coloring Books For Adults,Arts & Photography
http://ecx.images-amazon.com/images/I/512jyXFiGgL.jpg,Adobe Photoshop CS6 for Photographers: A professional image editor's guide to the creative use of Photoshop for the Macintosh and PC,Martin Evening,Computers & Technology
http://ecx.images-amazon.com/images/I/51jvmdjdrTL.jpg,"True Spirit: The True Story of a 16-Year-Old Australian Who Sailed Solo, Nonstop, and Unassisted Around the World",Jessica Watson,Biographies & Memoirs
http://ecx.images-amazon.com/images/I/41MvuM6pZ3L.jpg,Real-Life Discipleship Training Manual: Equipping Disciples Who Make Disciples,Jim Putman,Christian Books & Bibles
http://ecx.images-amazon.com/images/I/41kxxaZJphL.jpg,"7,500 Marriages from Old Ninety-Six & Abbeville District, S.C., (1774-1890",Larry E. Pursley,Law
http://ecx.images-amazon.com/images/I/41rieh%2Bmq0L.jpg,Nutrition and Behavior: New Perspectives,Robin B. Kanarek,"Health, Fitness & Dieting"
http://ecx.images-amazon.com/images/I/6144%2B8TKGVL.jpg,VERANDA The Art of Outdoor Living,Lisa Newsom,"Crafts, Hobbies & Home"
http://ecx.images-amazon.com/images/I/41HwiJ27T6L.jpg,"Blank Cookbook: Recipes & Notes; Football, Tailgate Party (1)",Rachel Stewart,"Cookbooks, Food & Wine"
http://ecx.images-amazon.com/images/I/51HH54qlRPL.jpg,Gut: The Inside Story of Our Body's Most Underrated Organ,Giulia Enders,Medical Books
http://ecx.images-amazon.com/images/I/516F3D3YCRL.jpg,Multinational Business Finance,David K. Eiteman,Business & Money
http://ecx.images-amazon.com/images/I/418A7wKROML.jpg,National Incident Management System: Principles And Practice,Dr. Donald W. Walsh,Politics & Social Sciences
http://ecx.images-amazon.com/images/I/51mZYwUvEZL.jpg,"The Word We Celebrate: Commentary on the Sunday Lectionary, Years A, B & C",Patricia Datchuck Sanchez,Religion & Spirituality
http://ecx.images-amazon.com/images/I/31PRGn192TL.jpg,Childrens Encyclopedia: The Usborne Internet-Linked (First Encyclopedias),Felicity Brooks,Reference
http://ecx.images-amazon.com/images/I/61BB4x3IpnL.jpg,Early One Morning,Virginia Baily,Literature & Fiction
http://ecx.images-amazon.com/images/I/415GHTFsHtL.jpg,Unveiling Grace: The Story of How We Found Our Way out of the Mormon Church,Lynn K. Wilder,Christian Books & Bibles
http://ecx.images-amazon.com/images/I/51OOE2xBSuL.jpg,The Man with No Endorphins,James Gorman,Humor & Entertainment
http://ecx.images-amazon.com/images/I/41QJWqr0x9L.jpg,The Kung Fu Handbook (Martial Arts (Rosen)),Peter Warr,Teen & Young Adult
http://ecx.images-amazon.com/images/I/51AWWGc7-IL.jpg,Pillsbury Easy as Pie: 140 Simple Recipes + 1 Readymade Pie Crust = Sweet Success (Pillsbury Cooking),Pillsbury Editors,"Cookbooks, Food & Wine"
http://ecx.images-amazon.com/images/I/41pQKcZTmNL.jpg,Finding Your Way After Your Spouse Dies,Marta Felber,Self-Help
http://ecx.images-amazon.com/images/I/51SE44E4HuL.jpg,Give Me Liberty!: An American History (Seagull Fourth Edition)  (Vol. 1),Eric Foner,History
http://ecx.images-amazon.com/images/I/41NC4BDJDAL.jpg,Wishful Thinking,Jacqi Lumer,"Health, Fitness & Dieting"
http://ecx.images-amazon.com/images/I/51JhfaAYn3L.jpg,"Leader Effectiveness Training: L.E.T. (Revised): ""L.E.T.""",Thomas Gordon,Business & Money
http://ecx.images-amazon.com/images/I/51HRClH49iL.jpg,Kaplan GMAT 800: Advanced Prep for Advanced Students (Kaplan Test Prep),Kaplan,Test Preparation
http://ecx.images-amazon.com/images/I/41Q6XEgLkmL.jpg,"The Alkaloids: Chemistry and Physiology  V13, Volume 13",,Science & Math
http://ecx.images-amazon.com/images/I/51V8At2OceL.jpg,Corrections in America: An Introduction (13th Edition),Harry E. Allen,Law
http://ecx.images-amazon.com/images/I/51DqYxXkZkL.jpg,"Chocolate, Strawberry, and Vanilla: A History Of American Ice Cream",Anne Cooper Funderburg,"Cookbooks, Food & Wine"
http://ecx.images-amazon.com/images/I/51TYY9lvP9L.jpg,Essentials of WJ IV Tests of Achievement (Essentials of Psychological Assessment),Nancy Mather,Medical Books
http://ecx.images-amazon.com/images/I/510Lmtjab2L.jpg,"Promo Poly-Canvas Bible / Book Cover w/Fish Applique (Large, Navy Blue)",Christian Art Gifts,Christian Books & Bibles
http://ecx.images-amazon.com/images/I/5145Ey4gmzL.jpg,Tall Ships 2016,,Calendars
http://ecx.images-amazon.com/images/I/51aKytpUPLL.jpg,The Writer of Modern Life: Essays on Charles Baudelaire,Walter Benjamin,Literature & Fiction
http://ecx.images-amazon.com/images/I/41NQeqiklRL.jpg,Overcoming Postpartum Depression and Anxiety,Linda Sebastian,"Health, Fitness & Dieting"
http://ecx.images-amazon.com/images/I/61B1RYFR4KL.jpg,"The Internet Kids & Family Yellow Pages, 1999 Edition",Jean Armour Polly,Computers & Technology
http://ecx.images-amazon.com/images/I/41VTT9itj4L.jpg,"Saving the Gray Whale: People, Politics, and Conservation in Baja California (Society, Environment, and Place)",Serge Dedina,Sports & Outdoors
http://ecx.images-amazon.com/images/I/514ATj1ZZ7L.jpg,What Is Islam?: The Importance of Being Islamic,Shahab Ahmed,Religion & Spirituality
http://ecx.images-amazon.com/images/I/514AQbzbDFL.jpg,Appalachian White Oak Basketmaking: Handing Down the Basket,Rachel Nash Law,"Crafts, Hobbies & Home"
http://ecx.images-amazon.com/images/I/51JDWuIiViL.jpg,The Inequality Hoax (Encounter Broadsides),James Piereson,Business & Money
http://ecx.images-amazon.com/images/I/41-8h-I1cZL.jpg,"Global Forum on Transparency and Exchange of Information for Tax Purposes Peer Reviews: Spain 2013: Combined: Phase 1 + Phase 2, incorporating Phase 2 ratings",Oecd Organisation For Economic Co-Operation And Development,Law
http://ecx.images-amazon.com/images/I/41tliM5J%2B4L.jpg,"Stallcup's Electrical Design, 2011 Edition",James G. Stallcup,Science & Math
http://ecx.images-amazon.com/images/I/41zCytugQaL.jpg,Bébé Day by Day: 100 Keys to French Parenting,Pamela Druckerman,Parenting & Relationships
http://ecx.images-amazon.com/images/I/51PrK3UWe-L.jpg,"Modern Architecture in Latin America: Art, Technology, and Utopia (Joe R. and Teresa Lozano Long Series in Latin American and L)",Luis E. Carranza,History
http://ecx.images-amazon.com/images/I/51S6i2NjyPL.jpg,WARP Book 1 The Reluctant Assassin,Eoin Colfer,Teen & Young Adult
http://ecx.images-amazon.com/images/I/11ZYJHQ654L.jpg,Document endometriosis baby could be (1999) ISBN: 4879542865 [Japanese Import],,"Health, Fitness & Dieting"
http://ecx.images-amazon.com/images/I/41NfH5UsmeL.jpg,Computer Applications in Medical Care,Donald A. B. Lindberg,Medical Books
http://ecx.images-amazon.com/images/I/51IWBMJJtGL.jpg,Fire Hall Cooking with Jeff the Chef: Surefire recipes to feed your crew,Jeff Derraugh,"Cookbooks, Food & Wine"
http://ecx.images-amazon.com/images/I/51js3BqJ30L.jpg,The Oxford Book of American Short Stories,,Literature & Fiction
http://ecx.images-amazon.com/images/I/515kZ1FnmrL.jpg,Vive Le Color! Energy (Coloring Book and Pencils): Color Therapy Kit,Abrams Noterie,Humor & Entertainment
http://ecx.images-amazon.com/images/I/51%2BmGU1HTPL.jpg,Bibliophilia: 100 Literary Postcards,Obvious State Studio,Arts & Photography
http://ecx.images-amazon.com/images/I/51%2Buc9PwVOL.jpg,"I, Robot",Isaac Asimov,Science Fiction & Fantasy
http://ecx.images-amazon.com/images/I/41xhwiEm8qL.jpg,Take the Stairs: Leadership Lessons Learned From a Lifetime of Service with Auto- Owners Insurance Company,Roger Looyenga,Engineering & Transportation
http://ecx.images-amazon.com/images/I/51dzeLk7odL.jpg,"Selling Online 2.0: Migrating from eBay to Amazon, craigslist, and Your Own E-Commerce Website",Michael Miller,Computers & Technology
http://ecx.images-amazon.com/images/I/410417DMX0L.jpg,The Circuit: Stories from the Life of a Migrant Child,Francisco Jiménez,"Mystery, Thriller & Suspense"
http://ecx.images-amazon.com/images/I/514%2BWzbedkL.jpg,War Room Bible Study - Bible Study Book,Stephen Kendrick,Christian Books & Bibles
http://ecx.images-amazon.com/images/I/51EvMsDbLzL.jpg,Stories Rabbits Tell,Susan E. Davis,"Crafts, Hobbies & Home"
http://ecx.images-amazon.com/images/I/51d15UNhhkL.jpg,I'd Kill For You,M. William Phelps,Biographies & Memoirs
http://ecx.images-amazon.com/images/I/51Jqt%2B8I3qL.jpg,"New Moon: The Graphic Novel, Vol. 1 (The Twilight Saga)",Stephenie Meyer,Comics & Graphic Novels
http://ecx.images-amazon.com/images/I/51SEYRPR0RL.jpg,Lacrosse Fundamentals,Jim Hinkson,Sports & Outdoors
http://ecx.images-amazon.com/images/I/41wb48eCvdL.jpg,Neurodegenerative Disorders (Perspectives on Diseases and Disorders),Sylvia Engdahl,"Health, Fitness & Dieting"
http://ecx.images-amazon.com/images/I/517D7KAYHQL.jpg,America's God and Country: Encyclopedia of Quotations,William J. Federer,Reference
http://ecx.images-amazon.com/images/I/51VZLWzII1L.jpg,"Physical Therapy and Massage for the Horse: Biomechanics-Excercise-Treatment, Second Edition",Jean-Marie Denoix,Medical Books
http://ecx.images-amazon.com/images/I/51NhR9mCCBL.jpg,From Humors to Medical Science: A HISTORY OF AMERICAN MEDICINE,John Duffy,Humor & Entertainment
http://ecx.images-amazon.com/images/I/51jKEo5XeRL.jpg,The End of American Labor Unions: The Right-to-Work Movement and the Erosion of Collective Bargaining,Raymond L. Hogler,Business & Money
http://ecx.images-amazon.com/images/I/51-teNB9NgL.jpg,A Christmas Far from Home: An Epic Tale of Courage and Survival during the Korean War,Stanley Weintraub,History
http://ecx.images-amazon.com/images/I/41c2q-Tx-tL.jpg,Laser Spectroscopy: Basic Concepts and Instrumentation,W. Demtroder,Science & Math
http://ecx.images-amazon.com/images/I/51-ZeuVkVZL.jpg,"How to know the ferns;: A guide to the names, haunts, and habits of our common ferns",Frances Theodora Parsons,"Crafts, Hobbies & Home"
http://ecx.images-amazon.com/images/I/51Z%2BL3eeUIL.jpg,Sexxxfessions,Andrea Blackstone,Romance
http://ecx.images-amazon.com/images/I/517-JyukMbL.jpg,To Bless the Space Between Us: A Book of Blessings,John O'Donohue,Christian Books & Bibles
http://ecx.images-amazon.com/images/I/51Y-JTdDdGL.jpg,Salesforce CRM: The Definitive Admin Handbook - Second Edition,Paul Goodey,Computers & Technology
http://ecx.images-amazon.com/images/I/61GZ6Q8Sj6L.jpg,Zoroastrianism: Its Antiquity and Constant Vigour (Columbia Lectures on Iranian Studies),Mary Boyce,Religion & Spirituality
http://ecx.images-amazon.com/images/I/41en48vmDmL.jpg,Beowulf - Autotypes Of The Unique Cotton Manuscript Vitellius A XV In The British Museum,Julius Zupitza,Literature & Fiction
http://ecx.images-amazon.com/images/I/411i2DBLVdL.jpg,"Business Valuation Manual - Unlocking The Value Of Your Business : How to increase it, measure it, and negotiate an actual sale price.",Thomas W. Horn,Business & Money
http://ecx.images-amazon.com/images/I/51%2BAZw8hkIL.jpg,Holt McDougal Larson Geometry: Student Edition 2012,HOLT MCDOUGAL,Teen & Young Adult
http://ecx.images-amazon.com/images/I/51W5sVZ2kvL.jpg,"Chemistry and Physics for Nurse Anesthesia, Second Edition: A Student-Centered Approach",David Shubert PhD,Medical Books
http://ecx.images-amazon.com/images/I/51lk%2BPtHBfL.jpg,"Savory Bites From Your Cake Pop Maker: 75 Fun Snacks, Adorable Appetizers and Delicious Entrees",Heather Torrone,"Cookbooks, Food & Wine"
http://ecx.images-amazon.com/images/I/51pqpo7Z8ZL.jpg,"Beale Street Dynasty: Sex, Song, and the Struggle for the Soul of Memphis",Preston Lauterbach,Politics & Social Sciences
http://ecx.images-amazon.com/images/I/51FWZBY30FL.jpg,Shake Hands with the Devil: The Failure of Humanity in Rwanda,Roméo Dallaire,Law
http://ecx.images-amazon.com/images/I/51AFf-donHL.jpg,"7 Steps to Health: Scientifically proven methods to help you stop, reverse, and even cure disease without the use of drugs, pills or surgery.",Max Sidorov KN,"Health, Fitness & Dieting"
http://ecx.images-amazon.com/images/I/51gCkp6kXLL.jpg,Seven Practices of Effective Ministry (North Point Resources),Andy Stanley,Christian Books & Bibles
http://ecx.images-amazon.com/images/I/615s-3AbFBL.jpg,"Victorian Goods and Merchandise: 2,300 Illustrations (Dover Pictorial Archive)",,Arts & Photography
http://ecx.images-amazon.com/images/I/41Phn2yfJXL.jpg,Dirty Jokes Every Man Should Know (Pocket Companions),,Humor & Entertainment
http://ecx.images-amazon.com/images/I/519jn3pZEQL.jpg,"Handbook on Agriculture, Biotechnology and Development",Stuart J. Smyth,Business & Money
http://ecx.images-amazon.com/images/I/51Xq87veHuL.jpg,Brushing My Teeth (Powerkids Readers: Clean & Healthy),Elizabeth Vogel,Teen & Young Adult
http://ecx.images-amazon.com/images/I/31T9wSnTUqL.jpg,CCNP SWITCH Lab Manual (2nd Edition) (Lab Companion),Cisco Networking Academy,Computers & Technology
http://ecx.images-amazon.com/images/I/31uTuvoX9TL.jpg,"Lipidomics and Bioactive Lipids:  Lipids and Cell Signaling, Volume 434 (Methods in Enzymology)",,Science & Math
http://ecx.images-amazon.com/images/I/51tPfFNGABL.jpg,Why Does He Do That?: Inside the Minds of Angry and Controlling Men,Lundy Bancroft,Parenting & Relationships
http://ecx.images-amazon.com/images/I/31Tw9R%2BWyrL.jpg,The Mafia in Italian Lives and Literature: Life Sentences and Their Geographies (Cultural Spaces),Robin Pickering-Iazzi,Biographies & Memoirs
http://ecx.images-amazon.com/images/I/51H63fV%2BX1L.jpg,"Small Animal Dermatology, Advanced Cases: Self-Assessment Color Review (Veterinary Self-Assessment Color Review Series)",Karen A Moriello,Medical Books
http://ecx.images-amazon.com/images/I/61JIL-L%2BbtL.jpg,The Minbar of Saladin: Reconstructing a Jewel of Islamic Art,,History
http://ecx.images-amazon.com/images/I/51Uk8aT%2BEWL.jpg,Paddling Long Island and New York City: The Best Sea Kayaking from Montauk to Manhasset Bay to Manhattan,Kevin Stiegelmaier,Sports & Outdoors
http://ecx.images-amazon.com/images/I/51WF4qbeuUL.jpg,Good Goats: Healing Our Image of God,Dennis Linn,Christian Books & Bibles
http://ecx.images-amazon.com/images/I/61EkVIStUqL.jpg,The Weaver's Inkle Pattern Directory: 400 Warp-Faced Weaves,Anne Dixon,"Crafts, Hobbies & Home"
http://ecx.images-amazon.com/images/I/41bk%2BnUeRJL.jpg,Theories of Development: Concepts and Applications,William Crain,Medical Books
http://ecx.images-amazon.com/images/I/51gKBcm8JuL.jpg,Essentials of Nursing Leadership & Management (with Premium Web Site Printed Access Card),Patricia Kelly,Medical Books
http://ecx.images-amazon.com/images/I/41kagIVLM5L.jpg,Lucie Rie,Tony Birks,Arts & Photography
http://ecx.images-amazon.com/images/I/41tY1vmd72L.jpg,"Federal Contracting Made Easy, Fourth Edition",Scott Stanberry,Law
http://ecx.images-amazon.com/images/I/511uwVl5DRL.jpg,American Pie: My Search for the Perfect Pizza,Peter Reinhart,"Cookbooks, Food & Wine"
http://ecx.images-amazon.com/images/I/51X793bZcDL.jpg,Ze Volume 11 (Yaoi Manga) (Ze Gn),Yuki Shimizu,Comics & Graphic Novels
http://ecx.images-amazon.com/images/I/61zdYdfGXIL.jpg,Excavator Monthly Compendium: All 6 Issues in One Book,William McAusland,Science Fiction & Fantasy
http://ecx.images-amazon.com/images/I/51nVSwBL2ZL.jpg,Energetic Anatomy: An Illustrated Guide to Understanding and Using the Human Energy System,Mark Rich,"Health, Fitness & Dieting"
http://ecx.images-amazon.com/images/I/51sqhWpx60L.jpg,Independent Luxury: The Four Innovation Strategies To Endure In The Consolidation Jungle,Jonas Hoffmann,Business & Money
http://ecx.images-amazon.com/images/I/410Xj0MAWCL.jpg,From Chaos to Clarity: Getting Unstuck & Creating A Life You Love,Alex Bratty,Self-Help
http://ecx.images-amazon.com/images/I/41jMNZBNn1L.jpg,Autodesk Maya 2010: The Modeling and Animation Handbook,Autodesk Maya Press,Computers & Technology
http://ecx.images-amazon.com/images/I/511uhNc%2B9tL.jpg,Diary of a Minecraft Zombie Book 1: A Scare of A Dare (Volume 1),Herobrine Books,Humor & Entertainment
http://ecx.images-amazon.com/images/I/416g5IN75jL.jpg,Dog Sees God: Confessions of a Teenage Blockhead - Acting Edition,Bert V. Royal,Literature & Fiction
http://ecx.images-amazon.com/images/I/51zJZ4n-dNL.jpg,G. R. S. Mead and the Gnostic Quest (Western Esoteric Masters),,Religion & Spirituality
http://ecx.images-amazon.com/images/I/51KJKQR1-%2BL.jpg,Climbing Mount Improbable,Richard Dawkins,Science & Math
http://ecx.images-amazon.com/images/I/41fB3VAM%2BNL.jpg,Date Rape Drugs (Understanding Drugs),Suellen May,Teen & Young Adult
http://ecx.images-amazon.com/images/I/51ftKEXneML.jpg,Law of Dispute Resolution: Arbitration and Alternative Dispute Resolution (Oceana's Legal Almanac Series: Law for the Layperson),Margaret C. Jasper,Engineering & Transportation
http://ecx.images-amazon.com/images/I/518W5sBJDJL.jpg,FTCE Exceptional Student Education K-12 Book + Online (FTCE Teacher Certification Test Prep),Ken Springer,Test Preparation
http://ecx.images-amazon.com/images/I/517vHAAt7PL.jpg,How to Brew: Everything You Need To Know To Brew Beer Right The First Time,John J. Palmer,"Cookbooks, Food & Wine"
http://ecx.images-amazon.com/images/I/41bN78PquiL.jpg,The Calling of Katie Makanya: A Memoir of South Africa,Margaret McCord,Biographies & Memoirs
http://ecx.images-amazon.com/images/I/51SkKU2IcdL.jpg,"ABC of Asthma, Allergies and Lupus: Eradicate Asthma - Now!",F. Batmanghelidj,"Health, Fitness & Dieting"
http://ecx.images-amazon.com/images/I/51DBNAqU6pL.jpg,The History of the Blessed Virgin Mary and the History of the Likeness of Christ Which the Jews of Tiberias Made to Mock At. the Syriac Texts,Budge E. a. Wallis (Ernest a. 1857-1934,History
http://ecx.images-amazon.com/images/I/51W%2BrhTr6XL.jpg,Experiments with Truth: Gandhi and Images of Nonviolence (Menil Collection),,Religion & Spirituality
http://ecx.images-amazon.com/images/I/51izlVKA--L.jpg,"Holding Communion Together: The Reformed Baptists, the First Fifty Years - Divided & United",Tom Chantry,Christian Books & Bibles
http://ecx.images-amazon.com/images/I/51QsI%2BJchWL.jpg,Justify My Thug (Thug Series),Wahida Clark,Romance
http://ecx.images-amazon.com/images/I/51kTS5aFNDL.jpg,"Prebles' Artforms Books a la Carte Edition, Prebles' Artforms (11th Edition)",Patrick L. Frank,Arts & Photography
http://ecx.images-amazon.com/images/I/41KfOXFJV7L.jpg,The Analysis of Controlled Substances (Analytical Techniques in the Sciences (AnTs) *),Michael D. Cole,Medical Books
http://ecx.images-amazon.com/images/I/61r%2BuiwddgL.jpg,By Chris Roberts Powwow 2015 Calendar (Native American) (Wall Calendar) [Calendar],,Calendars
http://ecx.images-amazon.com/images/I/51jMFcdymuL.jpg,Ezra and Hadassah: A Portrait of American Royalty,Heather M. Young,Law
http://ecx.images-amazon.com/images/I/51gd988c1cL.jpg,Microeconomics: Private and Public Choice,James D. Gwartney,Business & Money
http://ecx.images-amazon.com/images/I/61Um09J-sUL.jpg,Distinctive Presentations In Needle Art: A Complete Guide to Professional Finishing for Your Needlework,Marcia S. Brown,"Crafts, Hobbies & Home"
http://ecx.images-amazon.com/images/I/51cxk4cB2BL.jpg,"What to Talk About: On a Plane, at a Cocktail Party, in a Tiny Elevator with Your Boss's Boss",Chris Colin,Reference
http://ecx.images-amazon.com/images/I/51K23jUlPWL.jpg,Clinical Data Mining for Physician Decision Making and Investigating Health Outcomes: Methods for Prediction and Analysis (Premier Reference Source),Patricia Cerrito,Medical Books
http://ecx.images-amazon.com/images/I/410LppwLgZL.jpg,"A Theology of Liberation: History, Politics, and Salvation (15th Anniversary Edition with New Introduction by Author)",Gustavo Gutierrez,Christian Books & Bibles
http://ecx.images-amazon.com/images/I/51P59aVDfKL.jpg,The Life and Times of William Shakespeare (Shakespeare: His Work and World),,Teen & Young Adult
http://ecx.images-amazon.com/images/I/51WPze9rMbL.jpg,Crónica de una muerte anunciada (Spanish Edition),Gabriel García Márquez,Literature & Fiction
http://ecx.images-amazon.com/images/I/51ed3LqjpPL.jpg,Repetitive Strain Injury: A Computer User's Guide,Emil Pascarelli M.D.,"Health, Fitness & Dieting"
http://ecx.images-amazon.com/images/I/51bwwaGvU9L.jpg,Camp-Lore and Woodcraft,Daniel C. Beard,Sports & Outdoors
http://ecx.images-amazon.com/images/I/51RpJpDB%2BGL.jpg,Dental Practice Purchase and Sale: Expert Advice When It's Time to Pass The Torch,Philip Kempler DMD,Medical Books
http://ecx.images-amazon.com/images/I/51QG%2BsOuFXL.jpg,Wine Folly: The Essential Guide to Wine,Madeline Puckette,Humor & Entertainment
http://ecx.images-amazon.com/images/I/5131VaPHX2L.jpg,A Contemporary Cuba Reader: The Revolution under Raúl Castro,,History
http://ecx.images-amazon.com/images/I/51G7UbiuNxL.jpg,"A River Runs Again: India's Natural World in Crisis, from the Barren Cliffs of Rajasthan to the Farmlands of Karnataka",Meera Subramanian,Science & Math
http://ecx.images-amazon.com/images/I/51omgtQutxL.jpg,Persuasion: Social Influence and Compliance Gaining,Robert H Gass,Politics & Social Sciences
http://ecx.images-amazon.com/images/I/51ik9suNfCL.jpg,"A General History of The Pyrates From Their First Rise and Settlement in The Island of Providence, To The Present Time. With The Remarkable Actions and Adventures of The Two Female Pyrates Mary Read and Anne Bonnyto Which Is Added. A Short Abstract of The Statute and Civil Law, in Relation to Pyracy",Daniel Defoe,Law
http://ecx.images-amazon.com/images/I/511I-2hEUeL.jpg,Paths of Wisdom,John Michael Greer,Religion & Spirituality
http://ecx.images-amazon.com/images/I/615oeziKzBL.jpg,Family-Style Meals at the Hali'imaile General Store,Beverly Gannon,"Cookbooks, Food & Wine"
http://ecx.images-amazon.com/images/I/510KF7GAQFL.jpg,Travels in West Africa (National Geographic Adventure Classics),mary KINGSLEY,Biographies & Memoirs
http://ecx.images-amazon.com/images/I/51WBS-OdXyL.jpg,"Carolinas Fruit & Vegetable Gardening: How to Plant, Grow, and Harvest the Best Edibles (Fruit & Vegetable Gardening Guides)",Katie Elzer-Peters,"Crafts, Hobbies & Home"
http://ecx.images-amazon.com/images/I/51HbLAOr1vL.jpg,"Getting Started in 3D with Maya: Create a Project from Start to Finish - Model, Texture, Rig, Animate, and Render in Maya",Adam Watkins,Computers & Technology
http://ecx.images-amazon.com/images/I/41SczWdWSlL.jpg,Free to Choose: A Personal Statement,Milton Friedman,Business & Money
http://ecx.images-amazon.com/images/I/41PhL6PmTuL.jpg,"Parenting Teens With Love And Logic: Preparing Adolescents for Responsible Adulthood, Updated and Expanded Edition",Foster Cline,Parenting & Relationships
http://ecx.images-amazon.com/images/I/61R694V%2BPFL.jpg,"Flying over ABC: (Aruba, Bonaire, Curacao)",Karel Tomei,Arts & Photography
http://ecx.images-amazon.com/images/I/41Oe%2BZW-9CL.jpg,Spinal Cord Sensation: Sensory Processing in the Dorsal Horn,,"Health, Fitness & Dieting"
http://ecx.images-amazon.com/images/I/51sOOU5v6qL.jpg,"The Walking Dead: A Continuing Story of Survival Horror, Book 1",Robert Kirkman,Comics & Graphic Novels
http://ecx.images-amazon.com/images/I/51ySVDWUByL.jpg,Three Wishes: A Novel,Liane Moriarty,Literature & Fiction
http://ecx.images-amazon.com/images/I/51tLUzM0q5L.jpg,"Learning Radiology: Recognizing the Basics, 3e",William Herring MD  FACR,Medical Books
http://ecx.images-amazon.com/images/I/51PK9E6ZG2L.jpg,"Owning and Managing Forests: A Guide to Legal, Financial, and Practical Matters",Thomas J. McEvoy,Science & Math
http://ecx.images-amazon.com/images/I/513vo675qeL.jpg,"The Complete Fibromyalgia Health, Diet Guide and Cookbook: Includes Practical Wellness Solutions and 100 Delicious Recipes",Dr. Louise McCrindle,"Health, Fitness & Dieting"
http://ecx.images-amazon.com/images/I/41SD392SBWL.jpg,Sharpen Your Discernment,Roberts Liardon,Christian Books & Bibles
http://ecx.images-amazon.com/images/I/51vj9aMJGwL.jpg,The Impersonal Life,Joseph Benner,Self-Help
http://ecx.images-amazon.com/images/I/61PAs8QzGqL.jpg,Marathon,Boaz Yakin,Teen & Young Adult
http://ecx.images-amazon.com/images/I/41bTegNmN%2BL.jpg,"Interpretations of American History, Volume 2: From Reconstruction: Patterns & Perspectives",Francis G. Couvares,History
